"Using Code Evolution Information to Improve the Quality of Labels in Code Smell Datasets","Y. Wang; S. Hu; L. Yin; X. Zhou","School of Data and Computer Science, Sun Yat-sen University, Guangzhou, China; School of Data and Computer Science, Sun Yat-sen University, Guangzhou, China; School of Data and Computer Science, Sun Yat-sen University, Guangzhou, China; School of Data and Computer Science, Sun Yat-sen University, Guangzhou, China","2018 IEEE 42nd Annual Computer Software and Applications Conference (COMPSAC)","22 Jun 2018","2018","01","","48","53","Several approaches are proposed to detect code smells. A set of important approaches are based on machine learning algorithms, which require the code smells have been labeled in source codes as training data firstly. The common labeling approaches are based on manual or tools, but it is difficult for current approaches to get reliable large-scale datasets. In this paper, an approach using the evolution information of source codes is proposed to get large-scale and more reliable training datasets for detecting code smells based on machine learning algorithms. Our approach analyzes the evolving of the source code smells firstly labeled by a tool from the baseline version into the contrastive version of a software system, and then constructs training datasets based on those ""changed smells"". Experiments conducted on three open source software projects for detecting four types of code smells(which are Data Class, God Class, Brain Class and Brain Method) show that the models obtained by changed smells datasets have better performance on code smell detection than those obtained by unchanged smells datasets (with an average improvement rate of 7.8% and a maximum increase of 30%). The experiments results indicate that using the evolution information of source codes can construct more reliable training datasets for detecting code smells based on machine learning algorithms.","0730-3157","978-1-5386-2667-2","10.1109/COMPSAC.2018.00015","","https://ieeexplore.ieee.org/stamp/stamp.jsp?arnumber=8377639","Code smells;Training dataset;Machine learning;Refactoring","Tools;Training;Reliability;Java;Software;Machine learning algorithms;Labeling","learning (artificial intelligence);public domain software;software quality;source code (software)","code smell datasets;machine learning algorithms;source code;code evolution information;open source software project;software quality","","","","20","IEEE","22 Jun 2018","","","IEEE","IEEE Conferences"
"Detecting Code Smells using Deep Learning","A. K. Das; S. Yadav; S. Dhal","Department of Software Engineering, International Institute of Information Technology, Bangalore, India; Department of Computer Science and Engineering, Indian Institute of Information Technology, Guwahati, India; Department of Computer Science and Engineering, Indian Institute of Information Technology, Guwahati, India","TENCON 2019 - 2019 IEEE Region 10 Conference (TENCON)","12 Dec 2019","2019","","","2081","2086","A smell in software refers to a symptom introduced in software artifacts such as architecture, design or code. A code smell can potentially cause deeper and serious problems, while dealing with mainly non-functional requirements such as testability, maintainability, extensibility and scalability. The detection of code smell is an essential step in the refactoring process, which facilitates non functional requirements in a software. The existing approaches for detecting code smells use detection rules or standards using a combination of different object-oriented metrics. Although a variety of code smell detection tools have been developed, they still have limitations and constraints in their capabilities. The most well-known object-oriented metrics are considered to identify the presence of smells in software. This paper proposes a deep learning based approach to detect two code smells (Brain Class and Brain Method). The proposed system uses thirty open source Java projects, which are shared by many users in GitHub repositories. The dataset of these Java projects is partitioned into mutually exclusive training and test sets. Our experiments have demonstrated high accuracy results for both the code smells.","2159-3450","978-1-7281-1895-6","10.1109/TENCON.2019.8929628","","https://ieeexplore.ieee.org/stamp/stamp.jsp?arnumber=8929628","Code smells;Deep Learning;Object-oriented metrics;Code smell detection tools","Machine learning;Software;Measurement;Convolutional codes;Tools;Biological neural networks;Training","Java;learning (artificial intelligence);program testing;public domain software;software maintenance;software metrics;software quality","nonfunctional requirements;code smell detection tools;deep learning;software artifacts;refactoring process;open source Java projects;GitHub repositories;exclusive training sets;test sets","","4","","27","IEEE","12 Dec 2019","","","IEEE","IEEE Conferences"
"Code Bad Smell Detection through Evolutionary Data Mining","S. Fu; B. Shen","School of Software, Shanghai Jiao Tong University, Shanghai, China; School of Software, Shanghai Jiao Tong University, Shanghai, China","2015 ACM/IEEE International Symposium on Empirical Software Engineering and Measurement (ESEM)","9 Nov 2015","2015","","","1","9","The existence of code bad smell has a severe impact on the software quality. Numerous researches show that ignoring code bad smells can lead to failure of a software system. Thus, the detection of bad smells has drawn the attention of many researchers and practitioners. Quite a few approaches have been proposed to detect code bad smells. Most approaches are solely based on structural information extracted from source code. However, we have observed that some code bad smells have the evolutionary property, and thus propose a novel approach to detect three code bad smells by mining software evolutionary data: duplicated code, shotgun surgery, and divergent change. It exploits association rules mined from change history of software systems, upon which we define heuristic algorithms to detect the three bad smells. The experimental results on five open source projects demonstrate that the proposed approach achieves higher precision, recall and F-measure.","1949-3789","978-1-4673-7899-4","10.1109/ESEM.2015.7321194","","https://ieeexplore.ieee.org/stamp/stamp.jsp?arnumber=7321194","","Software systems;History;Association rules;Surgery;Couplings","data mining;evolutionary computation;software quality;source code (software)","code bad smell detection;software quality;source code;software evolutionary data mining;duplicated code;shotgun surgery;divergent change","","19","","31","IEEE","9 Nov 2015","","","IEEE","IEEE Conferences"
"A Deep Learning Based Approach to Detect Code Clones","G. Li; Y. Tang; X. Zhang; B. Yi","National Innovation Institute of Defense Technology, Beijing, China; National Innovation Institute of Defense Technology, Beijing, China; National Innovation Institute of Defense Technology, Beijing, China; National Innovation Institute of Defense Technology, Beijing, China","2020 International Conference on Intelligent Computing and Human-Computer Interaction (ICHCI)","10 May 2021","2020","","","337","340","Code clone is a kind of code smells widely exists in practice. Such code smell may lead to serious problems, e.g., code redundancy and code inconsistency. To reduce the negative impact of code clones, researchers have proposed different approaches to detect and remove code clones. However, existing code clone detection approaches mostly rely on manually designed and fine-tuned heuristic rules. Such approaches cannot be exploited in different projects and the precision of them needs to improve further. To this end, this paper proposes a deep learning based approach to detect code clones by statically extracting syntactic features from the ASTs of source files. Evaluation results suggest that the proposed approach is effective in detecting code clones, its precision is around 90%.","","978-1-6654-2316-8","10.1109/ICHCI51889.2020.00078","","https://ieeexplore.ieee.org/stamp/stamp.jsp?arnumber=9424815","code clone;software quality;deep learning","Deep learning;Human computer interaction;Redundancy;Cloning;Syntactics;Programming;Benchmark testing","deep learning (artificial intelligence);software maintenance;software quality;source code (software)","deep learning;code clones detection;code smell;syntactic features extraction;ASTs","","","","30","IEEE","10 May 2021","","","IEEE","IEEE Conferences"
"Bellwethers: A Baseline Method for Transfer Learning","R. Krishna; T. Menzies","Department of Computer Science, North Carolina State University, Raleigh; Department of Computer Science, North Carolina State University, Raleigh","IEEE Transactions on Software Engineering","12 Nov 2019","2019","45","11","1081","1105","Software analytics builds quality prediction models for software projects. Experience shows that (a) the more projects studied, the more varied are the conclusions; and (b) project managers lose faith in the results of software analytics if those results keep changing. To reduce this conclusion instability, we propose the use of “bellwethers”: given N projects from a community the bellwether is the project whose data yields the best predictions on all others. The bellwethers offer a way to mitigate conclusion instability because conclusions about a community are stable as long as this bellwether continues as the best oracle. Bellwethers are also simple to discover (just wrap a for-loop around standard data miners). When compared to other transfer learning methods (TCA+, transfer Naive Bayes, value cognitive boosting), using just the bellwether data to construct a simple transfer learner yields comparable predictions. Further, bellwethers appear in many SE tasks such as defect prediction, effort estimation, and bad smell detection. We hence recommend using bellwethers as a baseline method for transfer learning against which future work should be compared.","1939-3520","","10.1109/TSE.2018.2821670","National Science Foundation(grant numbers:#1506586,#1302169); ","https://ieeexplore.ieee.org/stamp/stamp.jsp?arnumber=8329264","Transfer learning;defect prediction;bad smells;issue close time;effort estimation;prediction","Estimation;Software;Software engineering;Task analysis;Benchmark testing;Complexity theory;Analytical models","learning (artificial intelligence);project management;software maintenance;software quality","software analytics;quality prediction models;software projects;transfer learning methods;bellwether data","","23","","154","IEEE","2 Apr 2018","","","IEEE","IEEE Journals"
"A case study in object-oriented patterns identified during manual refactoring","B. S. Dillon","Dahlgren Division Virginia Tech, Naval Surface Warfare Center, Blacksburg, VA, USA","2016 IEEE 14th International Conference on Software Engineering Research, Management and Applications (SERA)","21 Jul 2016","2016","","","91","98","Software design patterns are often-repeated implementations that have been identified and cataloged. These are commonly seen as useful and good patterns to implement. Occasionally the term “anti-pattern” has been used to identify less-useful patterns that also appear regularly. The exact definition of an anti-pattern is somewhat subjective, and the term has even been applied to some recognized design patterns. This paper discusses four manual refactoring case studies where patterns were discovered and cataloged. Evidence observed in the source code is used to infer how these patterns evolved. Based on these findings, preventive development practices are suggested. Potential improvements to development tools and a new method for pattern classification are suggested as subjects for future work.","","978-1-5090-0809-4","10.1109/SERA.2016.7516133","","https://ieeexplore.ieee.org/stamp/stamp.jsp?arnumber=7516133","Software evolution;reverse engineering;software aging;software quality;refactoring;design patterns;anti-patterns","Pattern recognition;Aging;Context;Manuals;Software design;Maintenance engineering","object-oriented methods;pattern classification;software maintenance;source code (software)","object-oriented patterns;manual refactoring;software design patterns;antipattern;source code;pattern classification","","","","25","IEEE","21 Jul 2016","","","IEEE","IEEE Conferences"
"An Experience Report on Using Code Smells Detection Tools","F. A. Fontana; E. Mariani; A. Mornioli; R. Sormani; A. Tonello","Department of Computer Science, Universita of Milano Bicocca, Milano, Italy; Department of Computer Science, Universita of Milano Bicocca, Milano, Italy; NA; Department of Computer Science, Universita of Milano Bicocca, Milano, Italy; Department of Computer Science, Universita of Milano Bicocca, Milano, Italy","2011 IEEE Fourth International Conference on Software Testing, Verification and Validation Workshops","14 Jul 2011","2011","","","450","457","Detecting code smells in the code and consequently applying the right refactoring steps when necessary is very important to improve the quality of the code. Different tools have been proposed for code smell detection, each one characterized by particular features. The aim of this paper is to describe our experience on using different tools for code smell detection. We outline the main differences among them and the different results we obtained.","","978-0-7695-4345-1","10.1109/ICSTW.2011.12","","https://ieeexplore.ieee.org/stamp/stamp.jsp?arnumber=5954446","code smells;code smell detection toools;refactoring;quality code evaluation","Measurement;Benchmark testing;Java;Software;Feature extraction;Couplings;Surgery","software maintenance;software quality","code smell detection tool;refactoring step;code quality;software characteristic","","36","","21","IEEE","14 Jul 2011","","","IEEE","IEEE Conferences"
"Feature Envy Detection based on Bi-LSTM with Self-Attention Mechanism","H. Wang; J. Liu; J. Kang; W. Yin; H. Sun; H. Wang","Shanghai Key Laboratory of Trustworthy Computing, East China Normal University, Shanghai, China; Shanghai Key Laboratory of Trustworthy Computing, East China Normal University, Shanghai, China; China Aeronautical Radio Electronics Research Institute, Shanghai, China; China Aeronautical Radio Electronics Research Institute, Shanghai, China; Shanghai Key Laboratory of Trustworthy Computing, East China Normal University, Shanghai, China; China Aeronautical Radio Electronics Research Institute, Shanghai, China","2020 IEEE Intl Conf on Parallel & Distributed Processing with Applications, Big Data & Cloud Computing, Sustainable Computing & Communications, Social Computing & Networking (ISPA/BDCloud/SocialCom/SustainCom)","4 Jun 2021","2020","","","448","457","Code Smell refers to suboptimal or harmful structures in the source code that may impede the maintainability of software. It serves as an effective way to detect refactoring opportunities. As the most prevailing smell, Feature Envy and its detection has been deeply explored for many years, which produces massive automated detection methods. Nevertheless, the heuristic-based approach cannot reach a satisfying level, and the machine learning approach still needs further optimization. Recent advances in deep learning inspire the birth of deep learning based approach. In this paper, we define a simpler distance metric as numerical feature and we collect class name and method name as text feature. Then we leverage Bidirectional Long-Short Term Memory (Bi-LSTM) Network with self-attention mechanism to extract semantic distance information in the text part, and we adopt embedding technology to enhance the structure distance information in the numerical part. Combined with the two sophisticatedly designed modules and the final classification module, a more reliable and accurate model is presented. Experimental results on seven open-source Java projects show that our model significantly outperforms existing methods.","","978-1-6654-1485-2","10.1109/ISPA-BDCloud-SocialCom-SustainCom51426.2020.00082","","https://ieeexplore.ieee.org/stamp/stamp.jsp?arnumber=9444004","Code smell;Feature Envy Detection;Bi-LSTM;Self-Attention Mechanism","Measurement;Deep learning;Semantics;Reliability theory;Network architecture;Feature extraction;Reliability engineering","data mining;Java;learning (artificial intelligence);public domain software;software maintenance;software metrics","structure distance information;numerical part;seven open-source Java projects;Feature Envy detection;Code Smell;suboptimal structures;harmful structures;source code;refactoring opportunities;prevailing smell;massive automated detection methods;heuristic-based approach;satisfying level;text part;semantic distance information;self-attention mechanism;leverage Bidirectional Long-Short Term Memory;text feature;method name;class name;numerical feature;simpler distance metric;deep learning based approach","","1","","37","IEEE","4 Jun 2021","","","IEEE","IEEE Conferences"
"Detecting code smells using machine learning techniques: Are we there yet?","D. Di Nucci; F. Palomba; D. A. Tamburri; A. Serebrenik; A. De Lucia","University of Salerno, Italy; University of Zurich, Switzerland; Eindhoven University of Technology, The Netherlands; Eindhoven University of Technology, The Netherlands; University of Salerno, Italy","2018 IEEE 25th International Conference on Software Analysis, Evolution and Reengineering (SANER)","5 Apr 2018","2018","","","612","621","Code smells are symptoms of poor design and implementation choices weighing heavily on the quality of produced source code. During the last decades several code smell detection tools have been proposed. However, the literature shows that the results of these tools can be subjective and are intrinsically tied to the nature and approach of the detection. In a recent work the use of Machine-Learning (ML) techniques for code smell detection has been proposed, possibly solving the issue of tool subjectivity giving to a learner the ability to discern between smelly and non-smelly source code elements. While this work opened a new perspective for code smell detection, it only considered the case where instances affected by a single type smell are contained in each dataset used to train and test the machine learners. In this work we replicate the study with a different dataset configuration containing instances of more than one type of smell. The results reveal that with this configuration the machine learning techniques reveal critical limitations in the state of the art which deserve further research.","","978-1-5386-4969-5","10.1109/SANER.2018.8330266","","https://ieeexplore.ieee.org/stamp/stamp.jsp?arnumber=8330266","Code Smells;Machine Learning;Empirical Studies;Replication Study","Detectors;Measurement;Tools;Software systems;Training;Predictive models;Buildings","learning (artificial intelligence);software maintenance","machine learning techniques;produced source code;code smell detection;single type smell;ML techniques;source code elements","","63","","90","IEEE","5 Apr 2018","","","IEEE","IEEE Conferences"
"Application of Naïve Bayes classifiers for refactoring Prediction at the method level","R. Panigrahi; S. K. kuanar; L. Kumar","Department of Computer Science and Engineering, GIET University, Gunupur, Odisha; Department of Computer Science and Engineering, GIET University, Gunupur, Odisha; Department of Computer Science and Information Systems, BITS-PILANI, Hyderabad, Hyderabad","2020 International Conference on Computer Science, Engineering and Applications (ICCSEA)","3 Jul 2020","2020","","","1","6","Software refactoring is a technique of redesigning the existing code without changing its functionality in order to improve on code readability, code adherence, maintainability and portability. Recent years have witnessed the advancement of research in the field of improvement in code quality. The challenges involved in the field has attracted many software practitioners to identify methods or classes that need refactoring. We propose a model to predict refactoring candidates by Naïve Bayes classifiers (Gaussian, Multinomial and Bernoulli (GNB, MNB, BNB)) at method level refactoring in terms of AUC and Accuracy. Method level refactoring is carried out on data set from the Tera-Promise repository and then validated. Min-max normalization and Imbalancing techniques are then applied. Then using the Wilcoxon rank test, 8 sets of significant features are drawn out of 103 sets of input features.The experimental results on the performance of 3 Naïve Bayes classifiers shows that the Bernoulli Naïve Bayes classifier gives more accuracy as compared to the other two classifiers. Statistical tests applied on all features (AF) and significant features (SF), shows that significant features gives more accurate prediction than all features.","","978-1-7281-5830-3","10.1109/ICCSEA49143.2020.9132849","","https://ieeexplore.ieee.org/stamp/stamp.jsp?arnumber=9132849","Software refactoring;code smell;naïve Bayes classifier","Meters;Computer science;Codes;Machine learning algorithms;Gaussian processes;Predictive models;Software","Bayes methods;pattern classification;software maintenance;software quality;source code (software)","Naïve Bayes classifiers;software refactoring;code readability;code adherence;code quality","","","","13","IEEE","3 Jul 2020","","","IEEE","IEEE Conferences"
"An improved behavioral matching for anti-pattern based abstract factory recommendation","N. Nahar; T. S. U. Mahmud; K. Sakib","Institute of Information Technology, University of Dhaka, Bangladesh; Dhaka University, Dhaka, Dhaka District, BD; Institute of Information Technology, University of Dhaka, Bangladesh","2016 5th International Conference on Informatics, Electronics and Vision (ICIEV)","1 Dec 2016","2016","","","35","40","For a developed project, Abstract Factory can be recommended using structural and behavioral matching between the defined anti-patterns and project code. This paper proposes a refinement of the existing behavioral matching technique, where all possible aspects of Abstract Factory behaviors are considered. This matching phase is enhanced by generating family matrix using conditional and action parse, and product type matrix using class association. Those two matrices are analysed to identify whether a pair of classes have the same product type. If no such matching is found, regeneration of family matrix by class wise parsing is done and again the matrices are analysed for recommending Abstract Factory. The approach is implemented in the form of a tool named Source code based Abstract Factory Pattern Recommender (SAFPR). The performance is justified by an experimental result analysis that showed, SAFPR is successful in Abstract Factory recommendation for all the dataset projects.","","978-1-5090-1269-5","10.1109/ICIEV.2016.7760115","","https://ieeexplore.ieee.org/stamp/stamp.jsp?arnumber=7760115","","Production facilities;Pattern matching;Software design;Switches;Recommender systems;Containers","pattern matching;program compilers;project management;software development management;source code (software)","improved behavioral matching;antipattern based abstract factory recommendation;structural matching;project code;abstract factory behaviors;family matrix;product type matrix;class association;class wise parsing;source code based abstract factory pattern recommender;SAFPR","","","","12","IEEE","1 Dec 2016","","","IEEE","IEEE Conferences"
