"Assessment of Code Smell for Predicting Class Change Proneness Using Machine Learning","N. Pritam; M. Khari; L. Hoang Son; R. Kumar; S. Jha; I. Priyadarshini; M. Abdel-Basset; H. Viet Long","Leading Pseudo Code Labs, Delhi, India; Department of Computer Science and Engineering, AIACTR, New Delhi, India; College of Electronics and Information Engineering, Sejong University, Seoul, South Korea; Department of Computer Science and Engineering, LNCT College, Jabalpur, India; School of Computer Engineering, KIIT University, Bhubaneswar, India; Department of Electrical and Computer Engineering, University of Delaware, Newark, DE, USA; Department of Operations Research and Decision Support, Zagazig University, Zagazig, Egypt; Faculty of Mathematics and Statistics, Ton Duc Thang University, Ho Chi Minh City, Vietnam","IEEE Access","1 Apr 2019","2019","7","","37414","37425","Assessment of code smell for predicting software change proneness is essential to ensure its significance in the area of software quality. While multiple studies have been conducted in this regard, the number of systems studied and the methods used in this paper are quite different, thus, causing confusion for understanding the best methodology. The objective of this paper is to approve the effect of code smell on the change inclination of a specific class in a product framework. This is the novelty and surplus of this work against the others. Furthermore, this paper aims to validate code smell for predicting class change proneness to find an error in the prediction of change proneness using code smell. Six typical machine learning algorithms (Naive Bayes Classifier, Multilayer Perceptron, LogitBoost, Bagging, Random Forest, and Decision Tree) have been used to predict change proneness using code smell from a set of 8200 Java classes spanning 14 software systems. The experimental results suggest that code smell is indeed a powerful predictor of class change proneness with multilayer perceptron being the most effective technique. The sensitivity and specificity values for all the models are well over 70% with a few exceptions.","2169-3536","","10.1109/ACCESS.2019.2905133","","https://ieeexplore.ieee.org/stamp/stamp.jsp?arnumber=8667419","Code smell;change proneness;software maintenance;machine learning;multilayer perceptron","Machine learning;Measurement;Machine learning algorithms;Multilayer perceptrons;Software systems;Tools","Bayes methods;decision trees;Java;learning (artificial intelligence);multilayer perceptrons;pattern classification;software maintenance;software quality","code smell;software systems;Java classes;decision tree;random forest;bagging;LogitBoost;multilayer perceptron;naive Bayes classifier;machine learning algorithms;class change proneness;software change proneness","","24","","29","OAPA","14 Mar 2019","","","IEEE","IEEE Journals"
"An Empirical Framework for Web Service Anti-pattern Prediction using Machine Learning Techniques","S. Tummalapalli; L. Kumar; L. B. M. Neti","BITS Pilani Hyderabad Campus, India; BITS Pilani Hyderabad Campus, India; BITS Pilani Hyderabad Campus, India","2019 9th Annual Information Technology, Electromechanical Engineering and Microelectronics Conference (IEMECON)","21 Oct 2019","2019","","","137","143","In todays software industries, the concepts of Web Services are applied to design and develop distributed software system. These distributed software system can be designed and developed by integrating different Web Services provided by different parties. Similar to other software systems, Web Services based system also suffers from bad or poor design i.e., bad design selection, anti-pattern, poor planning etc.. Early prediction of anti-patterns can help developer and tester in fixing design issue and also effectively utilize the resources. The work in this paper empirically investigates and evaluates six classification techniques, 8 feature selection techniques (7 feature ranking techniques and 1 feature subset evaluation technique), and 1 data sampling technique to handle imbalance data in predicting 5 different types of anti-patterns. These all techniques are validated on 226 real-world web-services across several domains. The performance of the developed models using these techniques are evaluated using AUC value. Our analysis reveals that the model developed using these techniques able to predict different anti-patterns using source code metrics. Our analysis also reveals that the best feature selection technique is OneR, data sample is better that without sampling and Random Forest is best classification algorithm for anti-pattern predictions.","","978-1-5386-9325-4","10.1109/IEMECONX.2019.8877008","","https://ieeexplore.ieee.org/stamp/stamp.jsp?arnumber=8877008","Anti-Patterns;Software Engineering;Source Code Metrics;Web Services;Machine Learning;Feature selection;Aggregation Measures","Measurement;Web services;Feature extraction;Predictive models;Tools;Software systems","data handling;distributed processing;DP industry;feature extraction;feature selection;learning (artificial intelligence);pattern classification;software metrics;Web services","machine learning;software industries;distributed software system;Web services;software systems;feature selection;data sampling;feature selection technique;Web service antipattern prediction;AUC value;source code metrics","","4","","18","IEEE","21 Oct 2019","","","IEEE","IEEE Conferences"
"Comparison of Multi-Label Classification Algorithms for Code Smell Detection","E. O. Kiyak; D. Birant; K. U. Birant","The Graduate School of Natural and Applied Sciences, Dokuz Eylul University, Izmir, Turkey; Department of Computer Engineering, Dokuz Eylul University, Izmir, Turkey; Department of Computer Engineering, Dokuz Eylul University, Izmir, Turkey","2019 3rd International Symposium on Multidisciplinary Studies and Innovative Technologies (ISMSIT)","16 Dec 2019","2019","","","1","6","Code smells in a source code shows the weakness of design or implementation. To detect code smells, several detection tools have been developed. However, these tools generally produce different results, since code smells are subjectively interpreted, informally defined and configured by the developers, domain-dependent and based on opinions and experiences. To cope with these issues, in this paper, we have used machine learning techniques, especially multi-label classification methods, to classify whether the given source code is affected with more than one code smells or not. We have conducted experiments on four code smell datasets and transformed them into two multi-label datasets (one for method level and the other one for class level). Two multi-label classification methods (Classifier Chains and Label Combination) and their ensemble models performed on the converted datasets using five different base classifiers. The results show that, as a base classifier, Random Forest algorithm performs better than Decision Tree, Naive Bayes, Support Vector Machine and Neural Network algorithms.","","978-1-7281-3789-6","10.1109/ISMSIT.2019.8932855","","https://ieeexplore.ieee.org/stamp/stamp.jsp?arnumber=8932855","code smell detection;multi-label classification;software engineering;machine learning","Classification algorithms;Machine learning;Support vector machines;Tools;Machine learning algorithms;Software algorithms;Decision trees","decision trees;learning (artificial intelligence);pattern classification;support vector machines","code smell datasets;multilabel datasets;multilabel classification methods;code smell detection;detection tools;source code;classifier chains;label combination;base classifiers;random forest algorithm","","1","","16","IEEE","16 Dec 2019","","","IEEE","IEEE Conferences"
"Do We Have a Chance to Fix Bugs When Refactoring Code Smells?","W. Ma; L. Chen; Y. Zhou; B. Xu","State Key Laboratory for Novel Software Technology Nanjing University, Nanjing, China; State Key Laboratory for Novel Software Technology Nanjing University, Nanjing, China; State Key Laboratory for Novel Software Technology Nanjing University, Nanjing, China; State Key Laboratory for Novel Software Technology Nanjing University, Nanjing, China","2016 International Conference on Software Analysis, Testing and Evolution (SATE)","12 Dec 2016","2016","","","24","29","Code smells are used to describe code structures that may cause detrimental effects on software and should be refactored. Previous studies show that some code smells have significant effect on faults. However, how to refactor code smells to reduce bugs still needs more concern. We investigate the possibility of prioritizing code smell refactoring with the help of fault prediction results. We also investigate the possibility of improving the performance of fault prediction by using code smell detection results. We use Cohen's Kappa statistic to report agreements between results of code smell detections and fault predictions. We use fault prediction result as an indicator to guide code smell refactoring. Our results show that refactoring Blob, Long Parameter List, and Refused Parent Be Request may have a good chance to detect and fix bugs, and some code smells are particularly useful for improving the recall of fault prediction.","","978-1-5090-4517-4","10.1109/SATE.2016.11","","https://ieeexplore.ieee.org/stamp/stamp.jsp?arnumber=7780189","Code smell;refactoring;refactoring prioritization;fault prediction","Computer bugs;Measurement;Software;Object oriented modeling;Predictive models;Complexity theory;Logistics","program debugging;software fault tolerance;software maintenance;software performance evaluation","bugs;code structures;code smell detection;Kappa statistic;code smell refactoring;Refused Parent Be Request;Long Parameter List;Blob;fault prediction performance improvement","","9","","35","IEEE","12 Dec 2016","","","IEEE","IEEE Conferences"
"Antipattern-Based Problem Injection for Assessing Performance and Reliability Evaluation Techniques","P. Keck; A. Van Hoorn; D. Okanović; T. Pitakrat; T. F. Düllmann","Inst. of Software Technol., University of Stuttgart, Stuttgart, Germany; Inst. of Software Technol., Universitat Stuttgart, Stuttgart, Baden-WÃ¼rttemberg, DE; Inst. of Software Technol., University of Stuttgart, Stuttgart, Germany; Inst. of Software Technol., University of Stuttgart, Stuttgart, Germany; Inst. of Software Technol., University of Stuttgart, Stuttgart, Germany","2016 IEEE International Symposium on Software Reliability Engineering Workshops (ISSREW)","19 Dec 2016","2016","","","64","70","A challenging problem with today's increasingly large and distributed software systems is their performance behavior. To help developers avoid or detect mistakes that lead to performance problems, many researchers in software performance engineering have come up with classifications of such problems, called antipatterns. To test the approaches for antipattern detection, data from running systems is required. However, the usefulness of this data is doubtful as it may or may not include manifestations of performance problems. In this paper, we classify existing performance antipatterns w.r.t. their suitability for being injected and, based on this, introduce an extensible tool that allows to inject instances of these antipatterns into existing applications. The approach can be useful for researchers to test and validate their automated runtime problem evaluation and prevention techniques. Using two exemplary performance antipatterns, it is demonstrated that the injection is easily possible and produces feasible, though currently rather clinical results.","","978-1-5090-3601-1","10.1109/ISSREW.2016.36","","https://ieeexplore.ieee.org/stamp/stamp.jsp?arnumber=7789382","performance antipatterns;problem injection;performance and reliability evaluation","Libraries;Bridges;Instruments;Software reliability;Software systems","distributed processing;pattern classification;software performance evaluation;software reliability","anti pattern-based problem injection;performance evaluation technique;reliability evaluation technique;distributed software systems;performance behavior;software performance engineering;anti pattern detection;automated runtime problem evaluation technique;automated runtime prevention technique","","5","","47","IEEE","19 Dec 2016","","","IEEE","IEEE Conferences"
"Keep it simple: Is deep learning good for linguistic smell detection?","S. Fakhoury; V. Arnaoudova; C. Noiseux; F. Khomh; G. Antoniol","School of Electrical Engineering and Computer Science, Washington State University, Pullman, USA; School of Electrical Engineering and Computer Science, Washington State University, Pullman, USA; Department of Computer and Software Engineering, Polytechnique Montréal, Montréal, Canada; Department of Computer and Software Engineering, Polytechnique Montréal, Montréal, Canada; Department of Computer and Software Engineering, Polytechnique Montréal, Montréal, Canada","2018 IEEE 25th International Conference on Software Analysis, Evolution and Reengineering (SANER)","5 Apr 2018","2018","","","602","611","Deep neural networks is a popular technique that has been applied successfully to domains such as image processing, sentiment analysis, speech recognition, and computational linguistic. Deep neural networks are machine learning algorithms that, in general, require a labeled set of positive and negative examples that are used to tune hyper-parameters and adjust model coefficients to learn a prediction function. Recently, deep neural networks have also been successfully applied to certain software engineering problem domains (e.g., bug prediction), however, results are shown to be outperformed by traditional machine learning approaches in other domains (e.g., recovering links between entries in a discussion forum). In this paper, we report our experience in building an automatic Linguistic Antipattern Detector (LAPD) using deep neural networks. We manually build and validate an oracle of around 1,700 instances and create binary classification models using traditional machine learning approaches and Convolutional Neural Networks. Our experience is that, considering the size of the oracle, the available hardware and software, as well as the theory to interpret results, deep neural networks are outperformed by traditional machine learning algorithms in terms of all evaluation metrics we used and resources (time and memory). Therefore, although deep learning is reported to produce results comparable and even superior to human experts for certain complex tasks, it does not seem to be a good fit for simple classification tasks like smell detection. Researchers and practitioners should be careful when selecting machine learning models for the problem at hand.","","978-1-5386-4969-5","10.1109/SANER.2018.8330265","","https://ieeexplore.ieee.org/stamp/stamp.jsp?arnumber=8330265","Antipattern Detection;Machine Learning;Con-volutional Neural Networks","Neural networks;Machine learning;Support vector machines;Linguistics;Task analysis;Machine learning algorithms;Vegetation","computational linguistics;convolution;feedforward neural nets;learning (artificial intelligence);pattern classification","deep neural networks;Convolutional Neural Networks;machine learning models;deep learning;linguistic smell detection;prediction function;automatic Linguistic Antipattern Detector;binary classification models","","8","","29","IEEE","5 Apr 2018","","","IEEE","IEEE Conferences"
"Evaluating Domain-Specific Metric Thresholds: An Empirical Study","A. Mori; G. Vale; M. Viggiato; J. Oliveira; E. Figueiredo; E. Cirilo; P. Jamshidi; C. Kastner","Computer Science Department, Federal University of Minas Gerais (UFMG), Belo Horizonte, Brazil; Department of Informatics and Mathematics, University of Passau, Passau, Germany; Computer Science Department, Federal University of Minas Gerais (UFMG), Belo Horizonte, Brazil; Computer Science Department, Pontifical Catholic University of Minas Gerais (PUC-Minas), Belo Horizonte, Brazil; Computer Science Department, Federal University of Minas Gerais (UFMG), Belo Horizonte, Brazil; Computer Science Department, Federal University of Sao Joao del-Rei (UFSJ), Sao Joao del-Rei, Brazil; Institute for Software Research, Carnegie Mellon University (CMU), Pittsburgh, United States; Institute for Software Research, Carnegie Mellon University (CMU), Pittsburgh, United States","2018 IEEE/ACM International Conference on Technical Debt (TechDebt)","30 Dec 2018","2018","","","41","50","Software metrics and thresholds provide means to quantify several quality attributes of software systems. Indeed, they have been used in a wide variety of methods and tools for detecting different sorts of technical debts, such as code smells. Unfortunately, these methods and tools do not take into account characteristics of software domains, as the intrinsic complexity of geo-localization and scientific software systems or the simple protocols employed by messaging applications. Instead, they rely on generic thresholds that are derived from heterogeneous systems. Although derivation of reliable thresholds has long been a concern, we still lack empirical evidence about threshold variation across distinct software domains. To tackle this limitation, this paper investigates whether and how thresholds vary across domains by presenting a large-scale study on 3,107 software systems from 15 domains. We analyzed the derivation and distribution of thresholds based on 8 well-known source code metrics. As a result, we observed that software domain and size are relevant factors to be considered when building benchmarks for threshold derivation. Moreover, we also observed that domain-specific metric thresholds are more appropriated than generic ones for code smell detection.","","978-1-4503-5713-5","","","https://ieeexplore.ieee.org/stamp/stamp.jsp?arnumber=8595098","Software metrics;thresholds;software domains","Benchmark testing;Software metrics;Software systems;Tools","software maintenance;software metrics;software quality","source code metrics;software thresholds;technical debts;geo-localization;messaging applications;reliable thresholds;heterogeneous systems;generic thresholds;scientific software systems;software metrics;code smell detection;domain-specific metric thresholds;threshold derivation;software domain;threshold variation","","6","","35","","30 Dec 2018","","","IEEE","IEEE Conferences"
"Are Smell-Based Metrics Actually Useful in Effort-Aware Structural Change-Proneness Prediction? An Empirical Study","H. Liu; Y. Yu; B. Li; Y. Yang; R. Jia","School of Computer Science and Engineering, Southeast University, Nanjing, China; Centre for Research in Computing, The Open University, UK; School of Computer Science and Engineering, Southeast University, Nanjing, China; State Key Laboratory for Novel Software Technology, Nanjing University, Nanjing, China; School of Software and Electrical Engineering, Swinburne University of Technology, Melbourne, Australia","2018 25th Asia-Pacific Software Engineering Conference (APSEC)","23 May 2019","2018","","","315","324","Bad code smells (also named as code smells) are symptoms of poor design choices in implementation. Existing increases the likelihood of subsequent changes (i.e., change-proness). However, to the best of our knowledge, no prior studies have leveraged smell-based metrics to predict particular change type (i.e., structural changes). Moreover, when evaluating the effectiveness of smell-based metrics in structural change-proneness prediction, none of existing studies take into account of the effort inspecting those change-prone source code. In this paper, we consider five smell-based metrics for effort-aware structural change-proneness prediction and compare these metrics with a baseline of well-known CK metrics in predicting particular categories of change types. Specifically, we first employ univariate logistic regression to analyze the correlation between each smell-based metric and structural change-proneness. Then, we build multivariate prediction models to examine the effectiveness of smell-based metrics in effort-aware structural change-proneness prediction when used alone and used together with the baseline metrics, respectively. Our experiments are conducted on six Java open-source projects with up to 60 versions and results indicate that: (1) all smell-based metrics are significantly related to structural change-proneness, except metric ANOS in hive and SCM in camel after removing confounding effect of file size; (2) in most cases, smell-based metrics outperform the baseline metrics in predicting structural change-proneness; and (3) when used together with the baseline metrics, the smell-based metrics are more effective to predict change-prone files with being aware of inspection effort.","2640-0715","978-1-7281-1970-0","10.1109/APSEC.2018.00046","","https://ieeexplore.ieee.org/stamp/stamp.jsp?arnumber=8719536","code smell;structual change;effort-aware;change-proneness prediction","Measurement;Tools;Predictive models;Java;Software;Data collection;Logistics","Java;public domain software;regression analysis;software maintenance;software metrics;software quality","effort-aware structural change-proneness prediction;change-prone source code;baseline metrics;smell-based metrics;univariate logistic regression;multivariate prediction models;Java open-source projects;change-prone files","","1","","37","IEEE","23 May 2019","","","IEEE","IEEE Conferences"
"Deep Learning Anti-Patterns from Code Metrics History","A. Barbez; F. Khomh; Y. -G. Guéhéneuc","Polytechnique Montreal, Canada; Polytechnique Montreal, Canada; Concordia University, Montreal, QC, Canada","2019 IEEE International Conference on Software Maintenance and Evolution (ICSME)","5 Dec 2019","2019","","","114","124","Anti-patterns are poor solutions to recurring design problems. Number of empirical studies have highlighted the negative impact of anti-patterns on software maintenance which motivated the development of various detection techniques. Most of these approaches rely on structural metrics of software systems to identify affected components while others exploit historical information by analyzing co-changes occurring between code components. By relying solely on one aspect of software systems (i.e., structural or historical), existing approaches miss some precious information which limits their performances. In this paper, we propose CAME (Convolutional Analysis of code Metrics Evolution), a deep-learning based approach that relies on both structural and historical information to detect anti-patterns. Our approach exploits historical values of structural code metrics mined from version control systems and uses a Convolutional Neural Network classifier to infer the presence of anti-patterns from this information. We experiment our approach for the widely know God Class anti-pattern and evaluate its performances on three software systems. With the results of our study, we show that: (1) using historical values of source code metrics allows to increase the precision; (2) CAME outperforms existing static machine-learning classifiers; and (3) CAME outperforms existing detection tools.","2576-3148","978-1-7281-3094-1","10.1109/ICSME.2019.00021","","https://ieeexplore.ieee.org/stamp/stamp.jsp?arnumber=8919037","Anti-patterns;Deep learning;Mining Software Repositories","Measurement;History;Software systems;Machine learning;Feature extraction;Open source software;Software maintenance","convolutional neural nets;data mining;learning (artificial intelligence);pattern classification;software maintenance;software metrics;software performance evaluation;software quality","historical values;structural code metrics;anti-patterns;God Class anti-pattern;software systems;source code metrics;structural metrics;historical information;code components;code Metrics Evolution;deep-learning based approach","","2","","40","IEEE","5 Dec 2019","","","IEEE","IEEE Conferences"
