"Design Flaws Prediction for Impact on Software Maintainability using Extreme Learning Machine","P. Thongkum; S. Mekruksavanich","Department of Software Engineering, University of Phayao, Phayao, Thailand; Department of Computer Engineering, University of Phayao, Phayao, Thailand","2020 Joint International Conference on Digital Arts, Media and Technology with ECTI Northern Section Conference on Electrical, Electronics, Computer and Telecommunications Engineering (ECTI DAMT & NCON)","11 May 2020","2020","","","79","82","The software that contains flaws in its design is an indication that the design and coding standards have been violated by the developer during the software system’s development. It has been observed in recent empirical studies that classes with flaws in the design flaws have a higher probability of change proneness or fault proneness when compared to classes without flaws in the design. There is an exponential increase in terms of the effort required to remove bugs due to design flaws in cases where the flaws are not detected in the early stages of the development of the software. The use of source code metrics for the prediction of design flaws can be implemented in the initial stages of the life cycle of the software development for the reduction of the testing effort and the maintenance of the software as well as the improvement of its quality. This empirical research study examines and assesses a variety of techniques for classification, feature selection, and data sampling in order to deal with the imbalance data for prediction of several categories of design flaws. The assessment of more than 20 application packages is the basis of the conclusions of this study. The results of the experiments indicate that the estimating capability of various classifiers, feature selection, and data imbalance techniques for the development of prediction models for design flaws can be confirmed. In addition, it was also revealed that the models that were developed through the use of one particular technique were found to be superior to the models that were developed with the use of other techniques, according to our analysis.","","978-1-7281-6398-7","10.1109/ECTIDAMTNCON48261.2020.9090717","","https://ieeexplore.ieee.org/stamp/stamp.jsp?arnumber=9090717","design flaws;Extreme Learning Machine;software metrics;software maintenance","Predictive models;Kernel;Computational modeling;Software metrics;Neurons","learning (artificial intelligence);pattern classification;probability;program debugging;software maintenance;software metrics;software quality","software system;design flaw prediction;feature selection;data imbalance techniques;design standard;coding standard;extreme learning machine;software development life cycle;software quality;classification;data sampling;software maintainability","","","","13","IEEE","11 May 2020","","","IEEE","IEEE Conferences"
"Do Code Smells Impact the Effort of Different Maintenance Programming Activities?","Z. Soh; A. Yamashita; F. Khomh; Y. -G. Guéhéneuc","Department of Computer and Software Engineering, Polytechnique de Montreal; Department of Information Technology, Oslo and Akershus University, Oslo, Norway; Department of Computer and Software Engineering, Polytechnique de Montreal; Department of Computer and Software Engineering, Polytechnique de Montreal","2016 IEEE 23rd International Conference on Software Analysis, Evolution, and Reengineering (SANER)","23 May 2016","2016","1","","393","402","Empirical studies have shown so far that code smells have relatively low impact over maintenance effort at file level. We surmise that previous studies have found low effects of code smells because the effort considered is a ""sheer-effort"" that does not distinguish between the kinds of developers' activities. In our study, we investigate the effects of code smells at the activity level. Examples of activities are: reading, editing, searching, and navigating, which are performed independently over different files during maintenance. We conjecture that structural attributes represented in the form of different code smells do indeed have an effect on the effort for performing certain kinds of activities. To verify this conjecture, we revisit a previous study about the impact of code smell on maintenance effort, using the same dataset, but considering activity effort. Six professional developers were hired to perform three maintenance tasks on four functionally equivalent Java Systems. Each developer performs two maintenance tasks. During maintenance task, we monitor developers' logs. Then, we define an annotation schema to identify developers' activities and assess whether code smells affect different maintenance activities. Results show that different code smells affect differently activity effort. Yet, the size of the changes performed to solve the task impacts the effort of all activities more than code smells and file size. While code smells impact the editing and navigating effort more than file size, the file size impacts the reading and searching activities more than code smells. One major implication of these results is that if code smells indeed affect the effort of certain kinds of activities, it means that their effects are contingent on the type of maintenance task at hand, where some kinds of activities will become more predominant than others.","","978-1-5090-1855-0","10.1109/SANER.2016.103","","https://ieeexplore.ieee.org/stamp/stamp.jsp?arnumber=7476660","code smells;programming activity;maintenance effort;program comprehension;software quality","Maintenance engineering;Navigation;Java;Programming;Software;Companies;Software engineering","file organisation;Java;software maintenance;software quality","maintenance programming activities;code smells;file level;structural attributes;maintenance effort;functionally equivalent Java systems;developer log monitoring;annotation schema;file size","","25","","40","IEEE","23 May 2016","","","IEEE","IEEE Conferences"
"Code Smell Detection: Towards a Machine Learning-Based Approach","F. A. Fontana; M. Zanoni; A. Marino; M. V. Mäntylä","Department of Informatics, Systems and Communication University of Milano-Bicocca, Milano, Italy; Department of Informatics, Systems and Communication University of Milano-Bicocca, Milano, Italy; Department of Informatics, Systems and Communication University of Milano-Bicocca, Milano, Italy; Aalto University, Helsinki, Finland","2013 IEEE International Conference on Software Maintenance","2 Dec 2013","2013","","","396","399","Several code smells detection tools have been developed providing different results, because smells can be subjectively interpreted and hence detected in different ways. Usually the detection techniques are based on the computation of different kinds of metrics, and other aspects related to the domain of the system under analysis, its size and other design features are not taken into account. In this paper we propose an approach we are studying based on machine learning techniques. We outline some common problems faced for smells detection and we describe the different steps of our approach and the algorithms we use for the classification.","1063-6773","978-0-7695-4981-1","10.1109/ICSM.2013.56","","https://ieeexplore.ieee.org/stamp/stamp.jsp?arnumber=6676916","code smells detection;machine learning techniques","Measurement;Machine learning algorithms;Detectors;Software;Conferences;Labeling;Accuracy","learning (artificial intelligence);pattern classification;program diagnostics","code smell detection tools;machine learning-based approach;classification","","94","","20","IEEE","2 Dec 2013","","","IEEE","IEEE Conferences"
"AdaBoost-based Refused Bequest Code Smell Detection with Synthetic Instances","H. Chen; Z. Ren; L. Qiao; Z. Zhou; G. Gao; Y. Ma; H. Jiang","School of Software, Dalian University of Technology, Dalian, China; School of Software, Dalian University of Technology, Dalian, China; Beijing Institute of Control Engineering, Beijing, China; School of Software, Dalian University of Technology, Dalian, China; School of Software, Dalian University of Technology, Dalian, China; Taiyuan University of Technology, Taiyuan, China; School of Software, Dalian University of Technology, Dalian, China","2020 7th International Conference on Dependable Systems and Their Applications (DSA)","26 Jan 2021","2020","","","78","89","Software requirements are constantly changing. Consequently, the development process is frequently under time pressure, which results in technical debt. To illustrate the symptoms of technical debt, 22 code smells have been introduced to indicate the poor design in code fragment, among which refused bequest is one of the most harmful smells and with high diffuseness. However, refused bequest is rarely taken into account because there is a lack of dataset. Moreover, it is difficult to design the detection rules for refused bequest compared with other popular smells. In this paper, we propose a machine-learning-based refused bequest smell detection framework SEADART, which features the utilization of a set of synthetic smelly instances. Specifically, SEADART comprises three components: (1) a smell generation approach, and (2) a model training strategy, and (3) an AdaBoost-based detection model. We evaluate the performance of the proposed framework. The evaluation results suggest that the generated smelly instances are reliable, and the trained AdaBoost model significantly outperforms the state-of-the-art over a real-world dataset.","","978-0-7381-2422-3","10.1109/DSA51864.2020.00019","Research and Development; National Natural Science Foundation of China; ","https://ieeexplore.ieee.org/stamp/stamp.jsp?arnumber=9331242","Technical Debt;Code Smell;Refused Bequest;AdaBoost","Measurement;Training;Java;Machine learning;Feature extraction;Software;Reliability","learning (artificial intelligence);software maintenance","code fragment;detection rules;machine learning;smell generation approach;AdaBoost-based detection model;trained AdaBoost model;synthetic instances;software requirements;technical debt;refused bequest code smell detection;SEADART","","","","29","IEEE","26 Jan 2021","","","IEEE","IEEE Conferences"
"An adaptive approach for automatic design defects detection in object-oriented systems","S. Mekruksavanich","Department of Computer Engineering, University of Phayao, Phayao, Thailand","2017 International Conference on Digital Arts, Media and Technology (ICDAMT)","24 Apr 2017","2017","","","342","346","Design defects in object-oriented software have a detrimental impact on quality and also increase maintenance costs. Timeous detection and identification of these flaws is, therefore, necessary to avoid adverse outcomes within the system. Metric-based heuristic frameworks have recently become popular for detecting and locating object-oriented design defects from the source code. Imperfections can occur at any level and obtaining proper threshold values is often a complicated process. To lessen this impact, an adjustable threshold methodology for metric-based design flaw detection was proposed through machine learning to compute the contribution and threshold values of each metric set. The threshold values were adjusted and adapted to conform to the software data input characteristics. Results demonstrated that the proposed method generated more appropriate threshold limits for the detection of design imperfections. Implementation was simple, less time-consuming and did not require expert knowledge compared to traditional procedures.","","978-1-5090-5210-3","10.1109/ICDAMT.2017.7904988","","https://ieeexplore.ieee.org/stamp/stamp.jsp?arnumber=7904988","Design flaws;Defect detection;Machine learning;Software metric","Neurons;Training;Maintenance engineering;Software systems;Software metrics","learning (artificial intelligence);object-oriented methods;software reliability","contribution value;threshold value;machine learning;metric-based design flaw detection;adjustable threshold methodology;metric-based heuristic frameworks;object-oriented software;object-oriented systems;automatic design defects detection","","1","","26","IEEE","24 Apr 2017","","","IEEE","IEEE Conferences"
"A Support Vector Machine Based Approach for Code Smell Detection","A. Kaur; S. Jain; S. Goel","Department of Computer Science and Engineering, Thapar University, Patiala, Punjab, India; Department of Computer Science and Engineering, Thapar University, Patiala, Punjab, India; Department of Computer Science and Engineering, Bennett University, G. Noida, Uttar Pradesh, India","2017 International Conference on Machine Learning and Data Science (MLDS)","22 Mar 2018","2017","","","9","14","Code smells may be introduced in software due to market rivalry, work pressure deadline, improper functioning, skills or inexperience of software developers. Code smells indicate problems in design or code which makes software hard to change and maintain. Detecting code smells could reduce the effort of developers, resources and cost of the software. Many researchers have proposed different techniques like DETEX for detecting code smells which have limited precision and recall. To overcome these limitations, a new technique named as SVMCSD has been proposed for the detection of code smells, based on support vector machine learning technique. Four code smells are specified namely God Class, Feature Envy, Data Class and Long Method and the proposed technique is validated on two open source systems namely ArgoUML and Xerces. The accuracy of SVMCSD is found to be better than DETEX in terms of two metrics, precision and recall, when applied on a subset of a system. While considering the entire system, SVMCSD detect more occurrences of code smells than DETEX.","","978-1-5386-3446-2","10.1109/MLDS.2017.8","","https://ieeexplore.ieee.org/stamp/stamp.jsp?arnumber=8320252","Code smells;Anti-patterns;Support Vector Machine;Software maintenance","Support vector machines;Measurement;Software systems;Training;Software quality;Computer science","learning (artificial intelligence);public domain software;software maintenance;software metrics;software quality;support vector machines","support vector machine;software developers;code smell detection;code smells;DETEX;SVMCSD","","12","","21","IEEE","22 Mar 2018","","","IEEE","IEEE Conferences"
"Structural Quality Metrics as Indicators of the Long Method Bad Smell: An Empirical Study","S. Charalampidou; E. -M. Arvanitou; A. Ampatzoglou; P. Avgeriou; A. Chatzigeorgiou; I. Stamelos","Rijksuniversiteit Groningen, Groningen, Groningen, NL; Department of Computer Science, University of Macedonia, Thessaloniki, Greece; Rijksuniversiteit Groningen, Groningen, Groningen, NL; Rijksuniversiteit Groningen, Groningen, Groningen, NL; Department of Computer Science, University of Macedonia, Thessaloniki, Greece; Department of Computer Science, University of Macedonia, Thessaloniki, Greece","2018 44th Euromicro Conference on Software Engineering and Advanced Applications (SEAA)","21 Oct 2018","2018","","","234","238","Empirical evidence has pointed out that Extract Method refactorings are among the most commonly applied refactorings by software developers. The identification of Long Method code smells and the ranking of the associated refactoring opportunities is largely based on the use of metrics, primarily with measures of cohesion, size and coupling. Despite the relevance of these proper-ties to the presence of large, complex and non-cohesive pieces of code, the empirical validation of these metrics has exhibited relatively low accuracy (max precision: 66%) regarding their predictive power for long methods or extract method opportunities. In this work we perform an empirical validation of the ability of cohesion, coupling and size metrics to predict the existence and the intensity of long method occurrences. According to the statistical analysis, the existence and the intensity of the Long Method smell can be effectively predicted by two size (LoC and NoLV), two coupling (MPC and RFC), and four cohesion (LCOM1, LCOM2, Coh, and CC) metrics. Furthermore, the integration of these metrics into a multiple logistic regression model can predict whether a method should be refactored with a precision of 89% and a recall of 91%. The model yields suggestions whose ranking is strongly correlated to the ranking based on the effect of the corresponding refactorings on source code (correl. coef. 0.520). The results are discussed by providing interpretations and implications for research and practice.","","978-1-5386-7383-6","10.1109/SEAA.2018.00046","","https://ieeexplore.ieee.org/stamp/stamp.jsp?arnumber=8498213","long method;coupling;cohesion;size;case study","Measurement;Couplings;Software;Predictive models;Logistics;Informatics;Statistical analysis","regression analysis;software maintenance;software metrics","empirical validation;coupling;size metrics;long method occurrences;cohesion;multiple logistic regression model;source code;structural quality metrics;empirical evidence;software developers;proper-ties;max precision;predictive power;extract method refactorings;long method bad smell;long method code;extract method opportunities","","5","","26","IEEE","21 Oct 2018","","","IEEE","IEEE Conferences"
"A Bayesian Approach for the Detection of Code and Design Smells","F. Khomh; S. Vaucher; Y. -G. Guéhéneuc; H. Sahraoui","Ptidej Team DGIGL, Ecole Polytechnique de Montrèal, Canada; GEODES DIRO, Université de Montreal, Canada; Ptidej Team DGIGL, Ecole Polytechnique de Montrèal, Canada; GEODES DIRO, Université de Montreal, Canada","2009 Ninth International Conference on Quality Software","15 Jan 2010","2009","","","305","314","The presence of code and design smells can have a severe impact on the quality of a program. Consequently, their detection and correction have drawn the attention of both researchers and practitioners who have proposed various approaches to detect code and design smells in programs. However, none of these approaches handle the inherent uncertainty of the detection process. We propose a Bayesian approach to manage this uncertainty. First, we present a systematic process to convert existing state-of-the-art detection rules into a probabilistic model. We illustrate this process by generating a model to detect occurrences of the Blob antipattern. Second, we present results of the validation of the model: we built this model on two open-source programs, GanttProject v1.10.2 and Xerces v2.7.0, and measured its accuracy. Third, we compare our model with another approach to show that it returns the same candidate classes while ordering them to minimise the quality analysts' effort. Finally, we show that when past detection results are available, our model can be calibrated using machine learning techniques to offer an improved, context-specific detection.","2332-662X","978-1-4244-5913-1","10.1109/QSIC.2009.47","","https://ieeexplore.ieee.org/stamp/stamp.jsp?arnumber=5381430","code smells;design smells;bayesian belief networks;software quality","Bayesian methods;Uncertainty;Software quality;Open source software;Electronic mail;Context modeling;Machine learning;Impedance;Quality assessment;Software systems","belief networks;software quality;uncertainty handling","Bayesian approach;uncertainty handling;probabilistic model;Blob antipattern;open source program;GanttProject v1.10.2;Xerces v2.7.0;quality analysts effort;machine learning technique;context specific detection;program quality;code smell detection;design smell detection;detection rules","","118","","32","IEEE","15 Jan 2010","","","IEEE","IEEE Conferences"
"Quantifying the Effect of Code Smells on Maintenance Effort","D. I. K. Sjøberg; A. Yamashita; B. C. D. Anda; A. Mockus; T. Dybå","Department of Informatics, University of Oslo, Oslo, Norway; Department of Informatics, University of Oslo, Oslo, Norway; Department of Informatics, University of Oslo, Oslo, Norway; Avaya Laboratories Research, Basking Ridge, NJ, USA; Universitetet i Oslo, Oslo, NO","IEEE Transactions on Software Engineering","25 Jul 2013","2013","39","8","1144","1156","Context: Code smells are assumed to indicate bad design that leads to less maintainable code. However, this assumption has not been investigated in controlled studies with professional software developers. Aim: This paper investigates the relationship between code smells and maintenance effort. Method: Six developers were hired to perform three maintenance tasks each on four functionally equivalent Java systems originally implemented by different companies. Each developer spent three to four weeks. In total, they modified 298 Java files in the four systems. An Eclipse IDE plug-in measured the exact amount of time a developer spent maintaining each file. Regression analysis was used to explain the effort using file properties, including the number of smells. Result: None of the 12 investigated smells was significantly associated with increased effort after we adjusted for file size and the number of changes; Refused Bequest was significantly associated with decreased effort. File size and the number of changes explained almost all of the modeled variation in effort. Conclusion: The effects of the 12 smells on maintenance effort were limited. To reduce maintenance effort, a focus on reducing code size and the work practices that limit the number of changes may be more beneficial than refactoring code smells.","1939-3520","","10.1109/TSE.2012.89","","https://ieeexplore.ieee.org/stamp/stamp.jsp?arnumber=6392174","Maintainability;object-oriented design;product metrics;code churn","Maintenance engineering;Java;Software;Surgery;Time measurement;Context;Electronic mail","Java;regression analysis;software maintenance","code smell effect quantification;maintenance effort;maintainable code;maintenance tasks;Java systems;Java files;Eclipse IDE plug-in;regression analysis;file properties;refused bequest;file size;code size reduction;code smell refactoring","","201","","46","IEEE","21 Dec 2012","","","IEEE","IEEE Journals"
"A Method to Derive Metric Thresholds for Software Product Lines","G. A. D. Vale; E. M. L. Figueiredo","Department of Computer Science, Federal University of Minas Gerais (UFMG), Belo Horizonte, MG, Brazil; Department of Computer Science, Federal University of Minas Gerais (UFMG), Belo Horizonte, MG, Brazil","2015 29th Brazilian Symposium on Software Engineering","12 Nov 2015","2015","","","110","119","A software product line (SPL) is a set of software systems that share a common and variable set of components (features). Software metrics provide basic means to quantify several quality aspects of SPL components. However, the effectiveness of the SPL measurement process is directly dependent on the definition of reliable thresholds. If thresholds are not properly defined, it is difficult to actually know whether a given metric value indicates a potential problem in the component implementation. There are several methods to derive thresholds for software metrics. However, there is little understanding about their appropriateness for the context of SPLs. This paper aims to propose a method to derive thresholds in the SPL context. Our method is evaluated in terms of recall and precision using two code smells (God Class and Lazy Class) detection strategies. The evaluation of our method is performed based on a benchmark of 33 SPLs and the results were compared with a method (baseline) with the same purpose used in the context of SPLs (not proposed). The results show that our method has better recall when compared with baseline.","","978-1-4673-9272-3","10.1109/SBES.2015.9","","https://ieeexplore.ieee.org/stamp/stamp.jsp?arnumber=7328015","Metrics;Thresholds;Software Product Lines","Benchmark testing;Software metrics;Software systems;Context;Programming","object-oriented programming;software metrics;software product lines","software product lines;software systems;software metric threshold;software quality;SPL components;SPL measurement process;component implementation;recall value;precision value;God Class;Lazy Class;code smell detection strategy","","12","","37","IEEE","12 Nov 2015","","","IEEE","IEEE Conferences"
