Item Title,Publication Title,Book Series Title,Journal Volume,Journal Issue,Item DOI,Authors,Publication Year,URL,Content Type
A survey of Intel SGX and its applications,Frontiers of Computer Science,,15.0,3,10.1007/s11704-019-9096-y,Wei ZhengYing WuXiaoxue WuChen FengYulei SuiXiapu LuoYajin Zhou,2020,http://link.springer.com/article/10.1007/s11704-019-9096-y,Article
Exploring the Relation Between Co-changes and Architectural Smells,SN Computer Science,,2.0,1,10.1007/s42979-020-00407-5,Darius SasParis AvgeriouRonald KruizingaRuben Scheedler,2020,http://link.springer.com/article/10.1007/s42979-020-00407-5,Article
Sexually transmitted infections related care-seeking behavior and associated factors among reproductive age women in Ethiopia: further analysis of the 2016 demographic and health survey,BMC Women's Health,,20.0,1,10.1186/s12905-020-01145-9,Simegnew Handebo,2020,http://link.springer.com/article/10.1186/s12905-020-01145-9,Article
The effectiveness of parent training for children with autism spectrum disorder: a systematic review and meta-analyses,BMC Psychiatry,,20.0,1,10.1186/s12888-020-02973-7,Shoumitro (Shoumi) DebAmeeta RetzerMeera RoyRupali AcharyaBharati LimbuAshok Roy,2020,http://link.springer.com/article/10.1186/s12888-020-02973-7,Article
The effect of Bellwether analysis on software vulnerability severity prediction models,Software Quality Journal,,28.0,4,10.1007/s11219-019-09490-1,Patrick Kwaku KudjoJinfu ChenSolomon MensahRichard AmankwahChristopher Kudjo,2020,http://link.springer.com/article/10.1007/s11219-019-09490-1,Article
A public unified bug dataset for java and its assessment regarding metrics and bug prediction,Software Quality Journal,,28.0,4,10.1007/s11219-020-09515-0,Rudolf FerencZoltán TóthGergely LadányiIstván SiketTibor Gyimóthy,2020,http://link.springer.com/article/10.1007/s11219-020-09515-0,Article
Identification of refactoring opportunities for source code based on class association relationships,Journal of Central South University,,27.0,12,10.1007/s11771-020-4576-7,Wei Liu 刘伟Na Yang 杨娜Xin-di Huang 黄辛迪Wei Hu 胡为Zhi-gang Hu 胡志刚,2020,http://link.springer.com/article/10.1007/s11771-020-4576-7,Article
Predicting technical debt from commit contents: reproduction and extension with automated feature selection,Software Quality Journal,,28.0,4,10.1007/s11219-020-09520-3,Leevi RantalaMika Mäntylä,2020,http://link.springer.com/article/10.1007/s11219-020-09520-3,Article
A multi-dimensional study on the state of the practice of REST APIs usage in Android apps,Automated Software Engineering,,27.0,3 - 4,10.1007/s10515-020-00272-9,Manel AbdellatifRafik TighiltAbdelkarim BelkhirNaouel MohaYann-Gaël GuéhéneucÉric Beaudry,2020,http://link.springer.com/article/10.1007/s10515-020-00272-9,Article
Image segmentation evaluation: a survey of methods,Artificial Intelligence Review,,53.0,8,10.1007/s10462-020-09830-9,Zhaobin WangE. WangYing Zhu,2020,http://link.springer.com/article/10.1007/s10462-020-09830-9,Article
Explainability as a non-functional requirement: challenges and recommendations,Requirements Engineering,,25.0,4,10.1007/s00766-020-00333-1,Larissa ChazetteKurt Schneider,2020,http://link.springer.com/article/10.1007/s00766-020-00333-1,Article
Restructuring Object-Oriented Software Systems Using Various Aspects of Class Information,Arabian Journal for Science and Engineering,,45.0,12,10.1007/s13369-020-04785-z,Amarjeet PrajapatiAnshu ParasharJitender Kumar Chhabra,2020,http://link.springer.com/article/10.1007/s13369-020-04785-z,Article
Measuring sustainable development in the education area using multi-criteria methods: a case study,Central European Journal of Operations Research,,28.0,4,10.1007/s10100-019-00641-0,Ewa RoszkowskaMarzena Filipowicz-Chomko,2020,http://link.springer.com/article/10.1007/s10100-019-00641-0,Article
Comparative Study of STPA and Bowtie Methods: Case of Hazard Identification for Pipeline Transportation,Journal of Failure Analysis and Prevention,,20.0,6,10.1007/s11668-020-01010-9,Wafia BenhamlaouiMounira RouainiaYiliu LiuMohammed Salah Medjram,2020,http://link.springer.com/article/10.1007/s11668-020-01010-9,Article
Contingent Convertible bond literature review: making everything and nothing possible?,Journal of Banking Regulation,,21.0,4,10.1057/s41261-019-00122-z,Philippe Oster,2020,http://link.springer.com/article/10.1057/s41261-019-00122-z,Article
Evaluating the usability and instructional design quality of Interactive Virtual Training for Teachers (IVT-T),Educational Technology Research and Development,,68.0,6,10.1007/s11423-020-09819-9,Elisa S. ShernoffKatherine Von SchalschaJoseph L. GabbardAlban DelmarreStacy L. FrazierCédric BucheChristine Lisetti,2020,http://link.springer.com/article/10.1007/s11423-020-09819-9,Article
FaReT: A free and open-source toolkit of three-dimensional models and software to study face perception,Behavior Research Methods,,52.0,6,10.3758/s13428-020-01421-4,Jason HaysClaudia WongFabian A. Soto,2020,http://link.springer.com/article/10.3758/s13428-020-01421-4,Article
"Rethinking, Reworking and Revolutionising the Turing Test",Minds and Machines,,30.0,4,10.1007/s11023-020-09553-4,Nicola DamassinoNicholas Novelli,2020,http://link.springer.com/article/10.1007/s11023-020-09553-4,Article
Blockchain applied to the construction supply chain: A case study with threat model,Frontiers of Engineering Management,,7.0,4,10.1007/s42524-020-0129-x,Gjorgji ShemovBorja Garcia de SotoHoda Alkhzaimi,2020,http://link.springer.com/article/10.1007/s42524-020-0129-x,Article
"User Experience (re)Design and Evaluation of a Self-Guided, Mobile Health App for Adolescents with Mild Traumatic Brain Injury",Journal of Formative Design in Learning,,4.0,2,10.1007/s41686-019-00038-x,Matthew SchmidtAllison P. FisherJoshua SensenbaughBrandt LingCarmen RiettaLynn BabcockBrad G. KurowskiShari L. Wade,2020,http://link.springer.com/article/10.1007/s41686-019-00038-x,Article
Role of conjecture mapping in applying a game-based strategy towards a case library: a view from educational design research,Journal of Computing in Higher Education,,32.0,3,10.1007/s12528-020-09251-1,Andrew A. TawfikMatthew SchmidtChelsy P. Hooper,2020,http://link.springer.com/article/10.1007/s12528-020-09251-1,Article
From the “Norwegian Flora” (Eighteenth Century) to “Plants and Tradition” (Twentieth Century): 200 Years of Norwegian Knowledge about Wild Plants,Economic Botany,,74.0,4,10.1007/s12231-020-09507-y,I. Teixidor-ToneuK. KjesrudE. BjerkeK. ParekhA. Kool,2020,http://link.springer.com/article/10.1007/s12231-020-09507-y,Article
Fast and Slow: Using Spritz for Academic Study?,"Technology, Knowledge and Learning",,25.0,4,10.1007/s10758-020-09442-w,Arinola AdefilaSean GrahamAshok Patel,2020,http://link.springer.com/article/10.1007/s10758-020-09442-w,Article
Beyond COVID-19: Applying “SDG logics” for resilient transformations,Journal of International Business Policy,,3.0,4,10.1057/s42214-020-00076-4,Jan Anton van ZantenRob van Tulder,2020,http://link.springer.com/article/10.1057/s42214-020-00076-4,Article
Individual and contextual factors associated with disposal of children’s stools in Papua New Guinea: evidence from the 2016–2018 demographic and health survey,BMC Public Health,,20.0,1,10.1186/s12889-020-09852-6,Abdul-Aziz SeiduEbenezer AgbagloBright Opoku AhinkorahLouis Kobina DadzieIshmael BukariEdward Kwabena AmeyawSanni Yaya,2020,http://link.springer.com/article/10.1186/s12889-020-09852-6,Article
Acceptability of menstrual products interventions for menstrual hygiene management among women and girls in Malawi,Reproductive Health,,17.0,1,10.1186/s12978-020-01045-z,Christabel KambalaAngela ChinangwaEffie ChipetaBelen TorondelTracy Morse,2020,http://link.springer.com/article/10.1186/s12978-020-01045-z,Article
Review of evolution of the public long-term care insurance (LTCI) system in different countries: influence and challenge,BMC Health Services Research,,20.0,1,10.1186/s12913-020-05878-z,Linhong ChenLu ZhangXiaocang Xu,2020,http://link.springer.com/article/10.1186/s12913-020-05878-z,Article
AI transparency: a matter of reconciling design with critique,AI & SOCIETY,,,,10.1007/s00146-020-01110-y,Tomasz Hollanek,2020,http://link.springer.com/article/10.1007/s00146-020-01110-y,Article
Effectiveness of struvite precipitation and ammonia stripping for recovery of phosphorus and nitrogen from anaerobic digestate: a systematic review,Environmental Evidence,,9.0,1,10.1186/s13750-020-00211-x,Dag LorickBiljana MacuraMarcus AhlströmAnders GrimvallRobin Harder,2020,http://link.springer.com/article/10.1186/s13750-020-00211-x,Article
Predicting Code Smells and Analysis of Predictions: Using Machine Learning Techniques and Software Metrics,Journal of Computer Science and Technology,,35.0,6,10.1007/s11390-020-0323-7,Mohammad Y. MhawishManjari Gupta,2020,http://link.springer.com/article/10.1007/s11390-020-0323-7,Article
How does code readability change during software evolution?,Empirical Software Engineering,,25.0,6,10.1007/s10664-020-09886-9,Valentina PiantadosiFabiana FierroSimone ScalabrinoAlexander SerebrenikRocco Oliveto,2020,http://link.springer.com/article/10.1007/s10664-020-09886-9,Article
Topic Modeling Based Warning Prioritization from Change Sets of Software Repository,Journal of Computer Science and Technology,,35.0,6,10.1007/s11390-020-0047-8,Jung-Been LeeTaek LeeHoh Peter In,2020,http://link.springer.com/article/10.1007/s11390-020-0047-8,Article
Congress of neurological surgeons systematic review and evidence-based guidelines update on the role of emerging developments in the management of newly diagnosed glioblastoma,Journal of Neuro-Oncology,,150.0,2,10.1007/s11060-020-03607-4,Christopher FarrellWenyin ShiAlexa BodmanJeffrey J. Olson,2020,http://link.springer.com/article/10.1007/s11060-020-03607-4,Article
An Empirical Investigation of Relevant Changes and Automation Needs in Modern Code Review,Empirical Software Engineering,,25.0,6,10.1007/s10664-020-09870-3,Sebastiano PanichellaNik Zaugg,2020,http://link.springer.com/article/10.1007/s10664-020-09870-3,Article
API compatibility issues in Android: Causes and effectiveness of data-driven detection techniques,Empirical Software Engineering,,25.0,6,10.1007/s10664-020-09877-w,Simone ScalabrinoGabriele BavotaMario Linares-VásquezValentina PiantadosiMichele LanzaRocco Oliveto,2020,http://link.springer.com/article/10.1007/s10664-020-09877-w,Article
On the time-based conclusion stability of cross-project defect prediction models,Empirical Software Engineering,,25.0,6,10.1007/s10664-020-09878-9,Abdul Ali BangashHareem SaharAbram HindleKarim Ali,2020,http://link.springer.com/article/10.1007/s10664-020-09878-9,Article
A longitudinal study of static analysis warning evolution and the effects of PMD on software quality in Apache open source projects,Empirical Software Engineering,,25.0,6,10.1007/s10664-020-09880-1,Alexander TrautschSteffen HerboldJens Grabowski,2020,http://link.springer.com/article/10.1007/s10664-020-09880-1,Article
"Publish or perish, but do not forget your software artifacts",Empirical Software Engineering,,25.0,6,10.1007/s10664-020-09851-6,Robert HeumüllerSebastian NielebockJacob KrügerFrank Ortmeier,2020,http://link.springer.com/article/10.1007/s10664-020-09851-6,Article
MapReduce-based big data framework using modified artificial neural network classifier for diabetic chronic disease prediction,Soft Computing,,24.0,21,10.1007/s00500-020-04943-3,R. RamaniK. Vimala DeviK. Ruba Soundar,2020,http://link.springer.com/article/10.1007/s00500-020-04943-3,Article
JOURNAL OF COMPUTER SCIENCE AND TECHNOLOGY,Journal of Computer Science and Technology,,35.0,6,10.1007/s11390-020-0007-3,,2020,http://link.springer.com/article/10.1007/s11390-020-0007-3,Article
Ontologies in education – state of the art,Education and Information Technologies,,25.0,6,10.1007/s10639-020-10226-z,Kristian StancinPatrizia PoscicDanijela Jaksic,2020,http://link.springer.com/article/10.1007/s10639-020-10226-z,Article
Congress of neurological surgeons systematic review and evidence-based guidelines update on the role of chemotherapeutic management and antiangiogenic treatment of newly diagnosed glioblastoma in adults,Journal of Neuro-Oncology,,150.0,2,10.1007/s11060-020-03601-w,Navid RedjalBrian V. NahedJorg DietrichSteven N. KalkanisJeffrey J. Olson,2020,http://link.springer.com/article/10.1007/s11060-020-03601-w,Article
Towards efficient and automated side-channel evaluations at design time,Journal of Cryptographic Engineering,,10.0,4,10.1007/s13389-020-00233-8,Danilo ŠijačićJosep BalaschBohan YangSantosh GhoshIngrid Verbauwhede,2020,http://link.springer.com/article/10.1007/s13389-020-00233-8,Article
Digital twin-driven system for roller conveyor line: design and control,Journal of Ambient Intelligence and Humanized Computing,,11.0,11,10.1007/s12652-020-01898-z,PengYu WangWeiChao LiuNan LiuYouPeng You,2020,http://link.springer.com/article/10.1007/s12652-020-01898-z,Article
Preface,Journal of Computer Science and Technology,,35.0,6,10.1007/s11390-020-0006-4,Tao XieZhi JinXuan-Dong LiGang HuangHausi A. MullerJun PangLi-Jun Zhang,2020,http://link.springer.com/article/10.1007/s11390-020-0006-4,Article
The role of radiation therapy in treatment of adults with newly diagnosed glioblastoma multiforme: a systematic review and evidence-based clinical practice guideline update,Journal of Neuro-Oncology,,150.0,2,10.1007/s11060-020-03612-7,Mateo ZiuBetty Y. S. KimWen JiangTimothy RykenJeffrey J. Olson,2020,http://link.springer.com/article/10.1007/s11060-020-03612-7,Article
Completing the Economic and Monetary Union: Wisdom Come Late?,Italian Economic Journal,,6.0,3,10.1007/s40797-019-00105-z,Francesco Spadafora,2020,http://link.springer.com/article/10.1007/s40797-019-00105-z,Article
Making context the central concept in privacy engineering,Research and Practice in Technology Enhanced Learning,,15.0,1,10.1186/s41039-020-00141-9,Tore HoelWeiqin ChenJan M. Pawlowski,2020,http://link.springer.com/article/10.1186/s41039-020-00141-9,Article
Ethereum smart contract security research: survey and future research opportunities,Frontiers of Computer Science,,15.0,2,10.1007/s11704-020-9284-9,Zeli WangHai JinWeiqi DaiKim-Kwang Raymond ChooDeqing Zou,2020,http://link.springer.com/article/10.1007/s11704-020-9284-9,Article
Machine Learning Techniques for Software Maintainability Prediction: Accuracy Analysis,Journal of Computer Science and Technology,,35.0,5,10.1007/s11390-020-9668-1,Sara ElmidaouiLaila CheikhiAli IdriAlain Abran,2020,http://link.springer.com/article/10.1007/s11390-020-9668-1,Article
Mining Design Pattern Use Scenarios and Related Design Pattern Pairs: A Case Study on Online Posts,Journal of Computer Science and Technology,,35.0,5,10.1007/s11390-020-0407-4,Dong LiuZhi-Lei RenZhong-Tian LongGuo-Jun GaoHe Jiang,2020,http://link.springer.com/article/10.1007/s11390-020-0407-4,Article
Insider trading around auto recalls: Does investor attention matter?,Review of Quantitative Finance and Accounting,,55.0,3,10.1007/s11156-019-00866-9,Omer N. GokalpSami KeskekAbdullah KumasMarshall A. Geiger,2020,http://link.springer.com/article/10.1007/s11156-019-00866-9,Article
Cryptanalysis of OCB2: Attacks on Authenticity and Confidentiality,Journal of Cryptology,,33.0,4,10.1007/s00145-020-09359-8,Akiko InoueTetsu IwataKazuhiko MinematsuBertram Poettering,2020,http://link.springer.com/article/10.1007/s00145-020-09359-8,Article
An analysis method for change propagation based on product feature network,Research in Engineering Design,,31.0,4,10.1007/s00163-020-00344-7,Liang ChenYu ZhengJuntong XiShaoyang Li,2020,http://link.springer.com/article/10.1007/s00163-020-00344-7,Article
The effects of bilingualism on executive functions: an updated quantitative analysis,Journal of Cultural Cognitive Science,,4.0,2,10.1007/s41809-020-00062-5,John G. Grundy,2020,http://link.springer.com/article/10.1007/s41809-020-00062-5,Article
Memory Load Effect in the Real-Time Processing of Scalar Implicatures,Journal of Psycholinguistic Research,,49.0,5,10.1007/s10936-020-09726-3,Jacee Cho,2020,http://link.springer.com/article/10.1007/s10936-020-09726-3,Article
Identifying barriers in telemedicine-supported integrated care research: scoping reviews and qualitative content analysis,Journal of Public Health,,28.0,5,10.1007/s10389-019-01065-5,Lorenz HarstPatrick TimpelLena OttoPeggy RichterBastian WollschlaegerKatja WinklerHannes Schlieter,2020,http://link.springer.com/article/10.1007/s10389-019-01065-5,Article
Breathing life into consumer rights: smartphone tools facilitating the “right to know” on substances of very high concern in REACH articles,Environmental Sciences Europe,,32.0,1,10.1186/s12302-020-00387-6,Julian SchentenMattheus BrenigMartin FührKilian Bizer,2020,http://link.springer.com/article/10.1186/s12302-020-00387-6,Article
Code smell detection using multi-label classification approach,Software Quality Journal,,28.0,3,10.1007/s11219-020-09498-y,Thirupathi GuggulothuSalman Abdul Moiz,2020,http://link.springer.com/article/10.1007/s11219-020-09498-y,Article
A Systematic Literature Review on Empirical Analysis of the Relationship Between Code Smells and Software Quality Attributes,Archives of Computational Methods in Engineering,,27.0,4,10.1007/s11831-019-09348-6,Amandeep Kaur,2020,http://link.springer.com/article/10.1007/s11831-019-09348-6,Article
An empirical investigation on the relationship between design and architecture smells,Empirical Software Engineering,,25.0,5,10.1007/s10664-020-09847-2,Tushar SharmaParamvir SinghDiomidis Spinellis,2020,http://link.springer.com/article/10.1007/s10664-020-09847-2,Article
Feature requests-based recommendation of software refactorings,Empirical Software Engineering,,25.0,5,10.1007/s10664-020-09871-2,Ally S. NyamaweHui LiuNan NiuQasim UmerZhendong Niu,2020,http://link.springer.com/article/10.1007/s10664-020-09871-2,Article
Evaluating the agreement among technical debt measurement tools: building an empirical benchmark of technical debt liabilities,Empirical Software Engineering,,25.0,5,10.1007/s10664-020-09869-w,Theodoros AmanatidisNikolaos MittasAthanasia MoschouAlexander ChatzigeorgiouApostolos AmpatzoglouLefteris Angelis,2020,http://link.springer.com/article/10.1007/s10664-020-09869-w,Article
The ‘as code’ activities: development anti-patterns for infrastructure as code,Empirical Software Engineering,,25.0,5,10.1007/s10664-020-09841-8,Akond RahmanEffat FarhanaLaurie Williams,2020,http://link.springer.com/article/10.1007/s10664-020-09841-8,Article
A preliminary analysis of self-adaptive systems according to different issues,Software Quality Journal,,28.0,3,10.1007/s11219-020-09502-5,Claudia RaibuletFrancesca Arcelli FontanaSimone Carettoni,2020,http://link.springer.com/article/10.1007/s11219-020-09502-5,Article
"A semi-automated BPMN-based framework for detecting conflicts between security, data-minimization, and fairness requirements",Software and Systems Modeling,,19.0,5,10.1007/s10270-020-00781-x,Qusai RamadanDaniel StrüberMattia SalnitriJan JürjensVolker RiedigerSteffen Staab,2020,http://link.springer.com/article/10.1007/s10270-020-00781-x,Article
An efficient classification approach in imbalanced datasets for intrinsic plagiarism detection,Evolving Systems,,11.0,3,10.1007/s12530-018-9232-1,Andrianna PolydouriEleni VathiGeorgios SiolasAndreas Stafylopatis,2020,http://link.springer.com/article/10.1007/s12530-018-9232-1,Article
Wait for it: identifying “On-Hold” self-admitted technical debt,Empirical Software Engineering,,25.0,5,10.1007/s10664-020-09854-3,Rungroj MaipraditChristoph TreudeHideaki HataKenichi Matsumoto,2020,http://link.springer.com/article/10.1007/s10664-020-09854-3,Article
Learning actionable analytics from multiple software projects,Empirical Software Engineering,,25.0,5,10.1007/s10664-020-09843-6,Rahul KrishnaTim Menzies,2020,http://link.springer.com/article/10.1007/s10664-020-09843-6,Article
Do code review measures explain the incidence of post-release defects?,Empirical Software Engineering,,25.0,5,10.1007/s10664-020-09837-4,Andrey KrutauzTapajit DeyPeter C. RigbyAudris Mockus,2020,http://link.springer.com/article/10.1007/s10664-020-09837-4,Article
Special issue on quality management for information systems,Software Quality Journal,,28.0,3,10.1007/s11219-020-09516-z,Mario PiattiniIgnacio García-Rodríguez de GuzmánRicardo Pérez-Castillo,2020,http://link.springer.com/article/10.1007/s11219-020-09516-z,Article
Opportunities in intelligent modeling assistance,Software and Systems Modeling,,19.0,5,10.1007/s10270-020-00814-5,Gunter MussbacherBenoit CombemaleJörg KienzleSilvia AbrahãoHyacinth AliNelly BencomoMárton BúrLoli BurgueñoGregor EngelsPierre JeanjeanJean-Marc JézéquelThomas KühnSébastien MosserHouari SahraouiEugene SyrianiDániel Varró,2020,http://link.springer.com/article/10.1007/s10270-020-00814-5,Article
Detection of uneven hoisting of a Tainter lock gate: a case study for The Dalles Lock and Dam,Journal of Civil Structural Health Monitoring,,10.0,4,10.1007/s13349-020-00401-8,Brian EickTravis B. FillmoreMatthew D. SmithQuincy AlexanderBillie F. Spencer Jr.,2020,http://link.springer.com/article/10.1007/s13349-020-00401-8,Article
A pattern-driven solution for designing multi-objective evolutionary algorithms,Natural Computing,,19.0,3,10.1007/s11047-018-9677-y,Giovani GuizzoSilvia R. Vergilio,2020,http://link.springer.com/article/10.1007/s11047-018-9677-y,Article
A hierarchical and process-oriented framework for disassemblability evaluation in product maintainability design,The International Journal of Advanced Manufacturing Technology,,110.0,3 - 4,10.1007/s00170-020-05830-9,Wenmin ZhuXiumin FanQichang He,2020,http://link.springer.com/article/10.1007/s00170-020-05830-9,Article
A solution to drawbacks in capturing execution requirements on heterogeneous platforms,The Journal of Supercomputing,,76.0,9,10.1007/s11227-020-03145-w,Rajesh Devaraj,2020,http://link.springer.com/article/10.1007/s11227-020-03145-w,Article
"Assessment of the ecological health of Geumchon stream using fish, benthic macroinvertebrate, and periphyton",Toxicology and Environmental Health Sciences,,12.0,3,10.1007/s13530-020-00064-4,Dohun LimYoonjin Lee,2020,http://link.springer.com/article/10.1007/s13530-020-00064-4,Article
Optimization of the Performance of Marine Diesel Engines to Minimize the Formation of SOx Emissions,Journal of Marine Science and Application,,19.0,3,10.1007/s11804-020-00156-0,Mina TadrosManuel VenturaC. Guedes Soares,2020,http://link.springer.com/article/10.1007/s11804-020-00156-0,Article
Diagnosing Insensitivity to Scope in Contingent Valuation,Environmental and Resource Economics,,77.0,1,10.1007/s10640-020-00470-9,Ana Faria LopesGorm Kipperberg,2020,http://link.springer.com/article/10.1007/s10640-020-00470-9,Article
Asking the Right Questions—Human Factors Considerations for Telemedicine Design,Current Allergy and Asthma Reports,,20.0,11,10.1007/s11882-020-00965-x,Sarah D. FouquetAndrew T. Miranda,2020,http://link.springer.com/article/10.1007/s11882-020-00965-x,Article
LSTM-based argument recommendation for non-API methods,Science China Information Sciences,,63.0,9,10.1007/s11432-019-2830-8,Guangjie LiHui LiuGe LiSijie ShenHanlin Tang,2020,http://link.springer.com/article/10.1007/s11432-019-2830-8,Article
E-cigarette environmental and fire/life safety risks in schools reported by secondary school teachers,BMC Public Health,,20.0,1,10.1186/s12889-020-09319-8,Maryanne L. Fakeh CampbellAndrew SansoneLauren N. GonzalezKevin R. J. SchrothDerek G. Shendell,2020,http://link.springer.com/article/10.1186/s12889-020-09319-8,Article
RADON: rational decomposition and orchestration for serverless computing,SICS Software-Intensive Cyber-Physical Systems,,35.0,1 - 2,10.1007/s00450-019-00413-w,G. CasaleM. ArtačW.-J. van den HeuvelA. van HoornP. JakovitsF. LeymannM. LongV. PapanikolaouD. PresenzaA. RussoS. N. SriramaD. A. TamburriM. WursterL. Zhu,2020,http://link.springer.com/article/10.1007/s00450-019-00413-w,Article
Collection and Elicitation of Business Process Compliance Patterns with Focus on Data Aspects,Business & Information Systems Engineering,,62.0,4,10.1007/s12599-019-00594-3,Thomas VoglhoferStefanie Rinderle-Ma,2020,http://link.springer.com/article/10.1007/s12599-019-00594-3,Article
"Design principles, architectural smells and refactorings for microservices: a multivocal review",SICS Software-Intensive Cyber-Physical Systems,,35.0,1 - 2,10.1007/s00450-019-00407-8,Davide NeriJacopo SoldaniOlaf ZimmermannAntonio Brogi,2020,http://link.springer.com/article/10.1007/s00450-019-00407-8,Article
Specification of cloud topologies and orchestration using TOSCA: a survey,Computing,,102.0,8,10.1007/s00607-019-00750-3,Julian BellendorfZoltán Ádám Mann,2020,http://link.springer.com/article/10.1007/s00607-019-00750-3,Article
The Ethical Education and Perspectives of Chinese Engineering Students: A Preliminary Investigation and Recommendations,Science and Engineering Ethics,,26.0,4,10.1007/s11948-019-00108-0,Rockwell F. Clancy,2020,http://link.springer.com/article/10.1007/s11948-019-00108-0,Article
An anonymous and secure key agreement protocol for NFC applications using pseudonym,Wireless Networks,,26.0,6,10.1007/s11276-020-02319-x,Mahdi GhafoorianMorteza Nikooghadam,2020,http://link.springer.com/article/10.1007/s11276-020-02319-x,Article
Exploring the Structure of an Algebra Text with Locales,Journal of Automated Reasoning,,64.0,6,10.1007/s10817-019-09537-9,Clemens Ballarin,2020,http://link.springer.com/article/10.1007/s10817-019-09537-9,Article
Supporting Elementary Teachers' Collective Inquiry into the “E” in STEM,Science & Education,,29.0,4,10.1007/s11191-020-00123-9,Elaine Silva MangianteKaitlin A. Gabriele-Black,2020,http://link.springer.com/article/10.1007/s11191-020-00123-9,Article
