Item Title,Publication Title,Book Series Title,Journal Volume,Journal Issue,Item DOI,Authors,Publication Year,URL,Content Type
ECBRP: An Efficient Cluster-Based Routing Protocol for Real-Time Multimedia Streaming in MANETs,Wireless Personal Communications,,61.0,2,10.1007/s11277-010-0023-7,Jinjing TaoGuangwei BaiHang ShenLei Cao,2011,http://link.springer.com/article/10.1007/s11277-010-0023-7,Article
The Efficacy of Single-Sex Education: Testing for Selection and Peer Quality Effects,Sex Roles,,65.0,9 - 10,10.1007/s11199-010-9903-2,Amy Roberson HayesErin E. PahlkeRebecca S. Bigler,2011,http://link.springer.com/article/10.1007/s11199-010-9903-2,Article
Using OWL ontologies for adaptive patient information modelling and preoperative clinical decision support,Knowledge and Information Systems,,29.0,2,10.1007/s10115-010-0351-7,Matt-Mouley BouamraneAlan RectorMartin Hurrell,2011,http://link.springer.com/article/10.1007/s10115-010-0351-7,Article
Equitable regulation of private forests,Small-scale Forestry,,10.0,4,10.1007/s11842-011-9161-3,Roje S. GooteeKeith A. BlatnerDavid M. BaumgartnerMatthew S. CarrollEdward P. Weber,2011,http://link.springer.com/article/10.1007/s11842-011-9161-3,Article
Assessing architectural evolution: a case study,Empirical Software Engineering,,16.0,5,10.1007/s10664-011-9164-x,Michel WermelingerYijun YuAngela LozanoAndrea Capiluppi,2011,http://link.springer.com/article/10.1007/s10664-011-9164-x,Article
“Remain Faithful to the Earth!”*: Reporting Experiences of Artifact-Centered Design in Healthcare,Computer Supported Cooperative Work (CSCW),,20.0,4 - 5,10.1007/s10606-011-9143-1,Federico Cabitza,2011,http://link.springer.com/article/10.1007/s10606-011-9143-1,Article
Formal methods for security in the Xenon hypervisor,International Journal on Software Tools for Technology Transfer,,13.0,5,10.1007/s10009-011-0195-9,Leo FreitasJohn McDermott,2011,http://link.springer.com/article/10.1007/s10009-011-0195-9,Article
Radiology IT: Applications Integration vs. Consolidation,Journal of Digital Imaging,,24.0,5,10.1007/s10278-010-9342-1,Peter K. Kijewski,2011,http://link.springer.com/article/10.1007/s10278-010-9342-1,Article
Experimental study and numerical simulation on compressive buckling behavior of thin steel skins in unilateral contact with rigid constraints,Frontiers of Architecture and Civil Engineering in China,,5.0,3,10.1007/s11709-011-0121-y,Nicholas KeageChristopher MaioloRebecca PierottiXing Ma,2011,http://link.springer.com/article/10.1007/s11709-011-0121-y,Article
Estimating the flaw size in drilled shafts using an impulse response method,KSCE Journal of Civil Engineering,,15.0,7,10.1007/s12205-011-0206-0,Sheng-Huoo NiYan-Hong HuangKuo-Feng LoJenq-Jy Charng,2011,http://link.springer.com/article/10.1007/s12205-011-0206-0,Article
Agent-based dynamic support for learning from collaborative brainstorming in scientific inquiry,International Journal of Computer-Supported Collaborative Learning,,6.0,3,10.1007/s11412-011-9124-x,Hao-Chuan WangCarolyn P. RoséChun-Yen Chang,2011,http://link.springer.com/article/10.1007/s11412-011-9124-x,Article
Gender Differences in Ethics Research: The Importance of Controlling for the Social Desirability Response Bias,Journal of Business Ethics,,103.0,1,10.1007/s10551-011-0843-8,Derek DaltonMarc Ortegren,2011,http://link.springer.com/article/10.1007/s10551-011-0843-8,Article
Adult cancer survivorship care: experiences from the LIVESTRONG centers of excellence network,Journal of Cancer Survivorship,,5.0,3,10.1007/s11764-011-0180-z,Marci K. CampbellIrene TessaroMindy GellinCarmina G. ValleShannon GoldenLeanne KayePatricia A. GanzMary S. McCabeLinda A. JacobsKaren SyrjalaBarbara AndersonAlison F. JonesKenneth Miller,2011,http://link.springer.com/article/10.1007/s11764-011-0180-z,Article
A meta-review of evidence on heart failure disease management programs: the challenges of describing and synthesizing evidence on complex interventions,Trials,,12.0,1,10.1186/1745-6215-12-194,Lori A SavardDavid R ThompsonAlexander M Clark,2011,http://link.springer.com/article/10.1186/1745-6215-12-194,Article
Pre-referral rectal artesunate in severe malaria: flawed trial,Trials,,12.0,1,10.1186/1745-6215-12-188,Karim F HirjiZulfiqarali G Premji,2011,http://link.springer.com/article/10.1186/1745-6215-12-188,Article
Rank-based refactoring decision support: two studies,Innovations in Systems and Software Engineering,,7.0,3,10.1007/s11334-011-0154-3,Liming ZhaoJane Huffman Hayes,2011,http://link.springer.com/article/10.1007/s11334-011-0154-3,Article
Investigating preferences for mosquito-control technologies in Mozambique with latent class analysis,Malaria Journal,,10.0,1,10.1186/1475-2875-10-200,Rachel A SmithVictoria C BarclayJill L Findeis,2011,http://link.springer.com/article/10.1186/1475-2875-10-200,Article
"Inherent illnesses and attacks: an ethnographic study of interpretations of childhood Acute Respiratory Infections (ARIs) in Manhiça, southern Mozambique",BMC Public Health,,11.0,1,10.1186/1471-2458-11-556,Lianne StrausKhátia MunguambeQuique BassatSonia MachevoChristopher PellAnna RocaRobert Pool,2011,http://link.springer.com/article/10.1186/1471-2458-11-556,Article
A crossover operator that uses Pareto optimality in its definition,TOP,,19.0,1,10.1007/s11750-009-0082-7,I. AlbertoP. M. Mateo,2011,http://link.springer.com/article/10.1007/s11750-009-0082-7,Article
Mobile phones and head tumours. The discrepancies in cause-effect relationships in the epidemiological studies - how do they arise?,Environmental Health,,10.0,1,10.1186/1476-069X-10-59,Angelo G LevisNadia MinicuciPaolo RicciValerio GennaroSpiridione Garbisa,2011,http://link.springer.com/article/10.1186/1476-069X-10-59,Article
"Systematic review and meta-analysis comparing land and aquatic exercise for people with hip or knee arthritis on function, mobility and other health outcomes",BMC Musculoskeletal Disorders,,12.0,1,10.1186/1471-2474-12-123,Stephanie I BatterhamSophie HeywoodJennifer L Keating,2011,http://link.springer.com/article/10.1186/1471-2474-12-123,Article
Evaluating distributed real-time and embedded system test correctness using system execution traces,Central European Journal of Computer Science,,1.0,2,10.2478/s13537-011-0012-2,James H. HillPooja VarshneyaDouglas C. Schmidt,2011,http://link.springer.com/article/10.2478/s13537-011-0012-2,Article
The Importance of the Geographic Level of Analysis in the Assessment of the Quality of Life: The Case of Spain,Social Indicators Research,,102.0,2,10.1007/s11205-010-9674-8,Eduardo GonzálezAna CárcabaJuan Ventura,2011,http://link.springer.com/article/10.1007/s11205-010-9674-8,Article
A Peek under the Engine Hood: The Methodology of Subnational Economic Governance Indices,Hague Journal on the Rule of Law,,3.0,2,10.1017/S1876404511200034,Edmund J. MaleskyNina Merchant-Vega,2011,http://link.springer.com/article/10.1017/S1876404511200034,Article
Quality distortions in vertical relations,Journal of Economics,,103.0,2,10.1007/s00712-011-0194-z,Pio BaakeVanessa von Schlippenbach,2011,http://link.springer.com/article/10.1007/s00712-011-0194-z,Article
Air pollution control in ferroalloy manufacturing industries: an Indian regulatory assessment,Clean Technologies and Environmental Policy,,13.0,3,10.1007/s10098-010-0311-7,Amitava Bandyopadhyay,2011,http://link.springer.com/article/10.1007/s10098-010-0311-7,Article
"Soundness of workflow nets: classification, decidability, and analysis",Formal Aspects of Computing,,23.0,3,10.1007/s00165-010-0161-4,W. M. P. van der AalstK. M. van HeeA. H. M. ter HofstedeN. SidorovaH. M. W. VerbeekM. VoorhoeveM. T. Wynn,2011,http://link.springer.com/article/10.1007/s00165-010-0161-4,Article
"Measuring the Incidence, Causes, and Repercussions of Protocol Amendments",Drug information journal : DIJ / Drug Information Association,,45.0,3,10.1177/009286151104500307,Kenneth A. Getz MBARachael Zuckerman MPHAnne B. Cropp PharmDAnna L. Hindle MScRandy Krauss PhDKenneth I. Kaitin PhD,2011,http://link.springer.com/article/10.1177/009286151104500307,Article
"Study of Mental Activity and Regular Training (SMART) in at risk individuals: A randomised double blind, sham controlled, longitudinal trial",BMC Geriatrics,,11.0,1,10.1186/1471-2318-11-19,Nicola J GatesMichael ValenzuelaPerminder S SachdevNalin A SinghBernhard T BauneHenry BrodatyChao SuoNidhi JainGuy C WilsonYi WangMichael K BakerDominique WilliamsonNasim ForoughiMaria A Fiatarone Singh,2011,http://link.springer.com/article/10.1186/1471-2318-11-19,Article
"Assessment of plastic waste generation and its potential recycling of household solid waste in Can Tho City, Vietnam",Environmental Monitoring and Assessment,,175.0,1 - 4,10.1007/s10661-010-1490-8,Nguyen Phuc ThanhYasuhiro MatsuiTakeshi Fujiwara,2011,http://link.springer.com/article/10.1007/s10661-010-1490-8,Article
Polytomous Latent Scales for the Investigation of the Ordering of Items,Psychometrika,,76.0,2,10.1007/s11336-010-9199-8,Rudy LigtvoetL. Andries van der ArkWicher P. BergsmaKlaas Sijtsma,2011,http://link.springer.com/article/10.1007/s11336-010-9199-8,Article
Bio-energy supply chains and stakeholders,Mitigation and Adaptation Strategies for Global Change,,16.0,4,10.1007/s11027-010-9272-8,Stefan Gold,2011,http://link.springer.com/article/10.1007/s11027-010-9272-8,Article
The faunal drugstore: Animal-based remedies used in traditional medicines in Latin America,Journal of Ethnobiology and Ethnomedicine,,7.0,1,10.1186/1746-4269-7-9,Rômulo RN AlvesHumberto N Alves,2011,http://link.springer.com/article/10.1186/1746-4269-7-9,Article
The value of improved water quality in Guadiana estuary—a transborder application of contingent valuation methodology,Letters in Spatial and Resource Sciences,,4.0,1,10.1007/s12076-011-0052-1,M. Helena GuimarãesCarlos SousaTiago GarciaTomaz DentinhoTomasz Boski,2011,http://link.springer.com/article/10.1007/s12076-011-0052-1,Article
A privacy threat analysis framework: supporting the elicitation and fulfillment of privacy requirements,Requirements Engineering,,16.0,1,10.1007/s00766-010-0115-7,Mina DengKim WuytsRiccardo ScandariatoBart PreneelWouter Joosen,2011,http://link.springer.com/article/10.1007/s00766-010-0115-7,Article
Complete genome sequence of Odoribacter splanchnicus type strain (1651/6T),Standards in Genomic Sciences,,4.0,2,10.4056/sigs.1714269,Markus GökerSabine GronowAhmet ZeytunMatt NolanSusan LucasAlla LapidusNancy HammonShweta DeshpandeJan-Fang ChengSam PitluckKonstantinos LioliosIoanna PaganiNatalia IvanovaKonstantinos MavromatisGalina OvchinikovaAmrita Pati,2011,http://link.springer.com/article/10.4056/sigs.1714269,Article
Clustering and forecasting of dissolved oxygen concentration on a river basin,Stochastic Environmental Research and Risk Assessment,,25.0,2,10.1007/s00477-010-0429-5,Marco CostaA. Manuela Gonçalves,2011,http://link.springer.com/article/10.1007/s00477-010-0429-5,Article
Enforcing kernel constraints by hardware-assisted virtualization,Journal in Computer Virology,,7.0,1,10.1007/s11416-009-0129-1,Éric LacombeVincent NicometteYves Deswarte,2011,http://link.springer.com/article/10.1007/s11416-009-0129-1,Article
Microbial community differences between propionate-fed microbial fuel cell systems under open and closed circuit conditions,Applied Microbiology and Biotechnology,,89.0,3,10.1007/s00253-010-2903-x,Daniel Aguirre de CárcerPhuc Thi HaJae Kyung JangIn Seop Chang,2011,http://link.springer.com/article/10.1007/s00253-010-2903-x,Article
Field Study of Salt Balance of a Land Application System,"Water, Air, & Soil Pollution",,215.0,1 - 4,10.1007/s11270-010-0455-4,Runbin DuanClifford B. FedlerChristopher D. Sheppard,2011,http://link.springer.com/article/10.1007/s11270-010-0455-4,Article
Work related musculoskeletal disorders amongst therapists in physically demanding roles: qualitative analysis of risk factors and strategies for prevention,BMC Musculoskeletal Disorders,,12.0,1,10.1186/1471-2474-12-24,Leanne PassierSteven McPhail,2011,http://link.springer.com/article/10.1186/1471-2474-12-24,Article
Use of a multidimensional approach to study the evolution of software complexity,Innovations in Systems and Software Engineering,,6.0,4,10.1007/s11334-010-0133-0,Raghvinder S. SangwanPamela Vercellone-SmithColin J. Neill,2010,http://link.springer.com/article/10.1007/s11334-010-0133-0,Article
Failure-aware workflow scheduling in cluster environments,Cluster Computing,,13.0,4,10.1007/s10586-010-0126-7,Zhifeng YuChenjia WangWeisong Shi,2010,http://link.springer.com/article/10.1007/s10586-010-0126-7,Article
The moderating effect of knowledge sharing on the relationship between manufacturing activities and business performance,Knowledge Management Research & Practice,,8.0,4,10.1057/kmrp.2010.21,Tsu-Te (Andrew) HuangLe ChenRodney A Stewart,2010,http://link.springer.com/article/10.1057/kmrp.2010.21,Article
The Effects of Ethical Codes on Ethical Perceptions of Actions Toward Stakeholders,Journal of Business Ethics,,97.0,4,10.1007/s10551-010-0521-2,Joseph A. McKinneyTisha L. EmersonMitchell J. Neubert,2010,http://link.springer.com/article/10.1007/s10551-010-0521-2,Article
Living Off Uncertainty: The Intelligent Animal Production of Dryland Pastoralists,The European Journal of Development Research,,22.0,5,10.1057/ejdr.2010.41,Saverio KrätliNikolaus Schareika,2010,http://link.springer.com/article/10.1057/ejdr.2010.41,Article
Study of the mechanical compression behavior of municipal solid waste by temperature-controlled compression tests,Environmental Earth Sciences,,61.0,8,10.1007/s12665-010-0481-y,Rong-Her ChenKuo-Sheng ChenChia-Nan Liu,2010,http://link.springer.com/article/10.1007/s12665-010-0481-y,Article
"Why don't some women attend antenatal and postnatal care services?: a qualitative study of community members' perspectives in Garut, Sukabumi and Ciamis districts of West Java Province, Indonesia",BMC Pregnancy and Childbirth,,10.0,1,10.1186/1471-2393-10-61,Christiana R TitaleyCynthia L HunterPeter HeywoodMichael J Dibley,2010,http://link.springer.com/article/10.1186/1471-2393-10-61,Article
International Society for Quality of Life Research ~ 2010 Conference Abstracts,Quality of Life Research,,19.0,1,10.1007/s11136-010-9766-6,,2010,http://link.springer.com/article/10.1007/s11136-010-9766-6,Article
An empirical investigation into open source web applications’ implementation vulnerabilities,Empirical Software Engineering,,15.0,5,10.1007/s10664-010-9131-y,Toan HuynhJames Miller,2010,http://link.springer.com/article/10.1007/s10664-010-9131-y,Article
Health care utilisation and immigration in Spain,The European Journal of Health Economics,,11.0,5,10.1007/s10198-009-0204-z,José-Ignacio AntónRafael Muñoz de Bustillo,2010,http://link.springer.com/article/10.1007/s10198-009-0204-z,Article
"Potential threat of malaria epidemics in a low transmission area, as exemplified by São Tomé and Príncipe",Malaria Journal,,9.0,1,10.1186/1475-2875-9-264,Pei-Wen LeeChia-Tai LiuVirgilio E do RosarioBruno de SousaHerodes Sacramento RampaoMen-Fang Shaio,2010,http://link.springer.com/article/10.1186/1475-2875-9-264,Article
Correlating pharmaceutical data with a national health survey as a proxy for estimating rural population health,Population Health Metrics,,8.0,1,10.1186/1478-7954-8-25,Ronald E CossmanJeralynn S CossmanWesley L JamesTroy BlanchardRichard ThomasLouis G PolArthur G Cosby,2010,http://link.springer.com/article/10.1186/1478-7954-8-25,Article
Understanding the human context in requirements elicitation,Requirements Engineering,,15.0,3,10.1007/s00766-009-0087-7,Rubén Fuentes-FernándezJorge J. Gómez-SanzJuan Pavón,2010,http://link.springer.com/article/10.1007/s00766-009-0087-7,Article
Design-related bias in estimates of accuracy when comparing imaging tests: examples from breast imaging research,European Radiology,,20.0,9,10.1007/s00330-010-1779-6,Nehmat HoussamiStefano Ciatto,2010,http://link.springer.com/article/10.1007/s00330-010-1779-6,Article
"International Federation for the Surgery of Obesity and Metabolic Disorders. XV World Congress, Long Beach Convention Center –  Long Beach, California, USA. September 3–7, 2010",Obesity Surgery,,20.0,8,10.1007/s11695-010-0216-x,,2010,http://link.springer.com/article/10.1007/s11695-010-0216-x,Article
On the benefits of quantification in AspectJ systems,Journal of the Brazilian Computer Society,,16.0,2,10.1007/s13173-010-0008-0,Marco Tulio ValenteCesar CoutoJaqueline FariaSérgio Soares,2010,http://link.springer.com/article/10.1007/s13173-010-0008-0,Article
Beyond Simon’s Means-Ends Analysis: Natural Creativity and the Unanswered ‘Why’ in the Design of Intelligent Systems for Problem-Solving,Minds and Machines,,20.0,3,10.1007/s11023-010-9198-7,Sukanto BhattacharyaYonggui WangDongming Xu,2010,http://link.springer.com/article/10.1007/s11023-010-9198-7,Article
"The Use of Qualitative Comparative Analysis for Critical Event Research in Alcohol and HIV in Mumbai, India",AIDS and Behavior,,14.0,1,10.1007/s10461-010-9736-6,Jean J. SchensulDevyani ChandranS. K. SinghMarlene BergSharad SinghKamla Gupta,2010,http://link.springer.com/article/10.1007/s10461-010-9736-6,Article
VIREX and VRXQuery: interactive approach for visual querying of relational databases to produce XML,Journal of Intelligent Information Systems,,35.0,1,10.1007/s10844-009-0087-6,Anthony LoTansel ÖzyerKeivan KianmehrReda Alhajj,2010,http://link.springer.com/article/10.1007/s10844-009-0087-6,Article
Anti-cyanobacterial activity of Moringa oleifera seeds,Journal of Applied Phycology,,22.0,4,10.1007/s10811-009-9485-y,Miquel LürlingWendy Beekman,2010,http://link.springer.com/article/10.1007/s10811-009-9485-y,Article
A case study to evaluate the suitability of graph transformation tools for program refactoring,International Journal on Software Tools for Technology Transfer,,12.0,3 - 4,10.1007/s10009-010-0153-y,Javier PérezYania CrespoBerthold HoffmannTom Mens,2010,http://link.springer.com/article/10.1007/s10009-010-0153-y,Article
"Utilization and management practices of animal manure for replenishing soil fertility among smallscale crop farmers in semi-arid farming districts of the North West Province, South Africa",Nutrient Cycling in Agroecosystems,,87.0,3,10.1007/s10705-010-9347-7,Simeon A. Materechera,2010,http://link.springer.com/article/10.1007/s10705-010-9347-7,Article
Reproduction of the West Mediterranean endemic Arum pictum (Araceae) on Corsica,Plant Systematics and Evolution,,287.0,3 - 4,10.1007/s00606-010-0312-3,Angélique QuilichiniDavid MacquartDenis BarabéJérôme AlbreMarc Gibernau,2010,http://link.springer.com/article/10.1007/s00606-010-0312-3,Article
Code generation by model transformation: a case study in transformation modularity,Software & Systems Modeling,,9.0,3,10.1007/s10270-009-0136-1,Zef HemelLennart C. L. KatsDanny M. GroenewegenEelco Visser,2010,http://link.springer.com/article/10.1007/s10270-009-0136-1,Article
"Adapting plans in progress in distributed supervisory work: aspects of complexity, coupling, and control","Cognition, Technology & Work",,12.0,2,10.1007/s10111-010-0150-7,Tom Kontogiannis,2010,http://link.springer.com/article/10.1007/s10111-010-0150-7,Article
"New Urbanist developments in flood-prone areas: safe development, or safe development paradox?",Natural Hazards,,53.0,3,10.1007/s11069-009-9450-8,Mark R. StevensYan SongPhilip R. Berke,2010,http://link.springer.com/article/10.1007/s11069-009-9450-8,Article
FROM PISA TO EDUCATIONAL STANDARDS: THE IMPACT OF LARGE-SCALE ASSESSMENTS ON SCIENCE EDUCATION IN GERMANY,International Journal of Science and Mathematics Education,,8.0,3,10.1007/s10763-010-9206-7,Knut NeumannHans E. FischerAlexander Kauertz,2010,http://link.springer.com/article/10.1007/s10763-010-9206-7,Article
"Preferred analysis methods for Affymetrix GeneChips. II. An expanded, balanced, wholly-defined spike-in dataset",BMC Bioinformatics,,11.0,1,10.1186/1471-2105-11-285,Qianqian ZhuJeffrey C MiecznikowskiMarc S Halfon,2010,http://link.springer.com/article/10.1186/1471-2105-11-285,Article
From a domain analysis to the specification and detection of code and design smells,Formal Aspects of Computing,,22.0,3 - 4,10.1007/s00165-009-0115-x,Naouel MohaYann-Gaël GuéhéneucAnne-Françoise Le MeurLaurence DuchienAlban Tiberghien,2010,http://link.springer.com/article/10.1007/s00165-009-0115-x,Article
Editorial,Formal Aspects of Computing,,22.0,3 - 4,10.1007/s00165-010-0151-6,J. L. Fiadeiro,2010,http://link.springer.com/article/10.1007/s00165-010-0151-6,Article
Mathematical Context in Interactive Documents,Mathematics in Computer Science,,3.0,3,10.1007/s11786-010-0026-5,A. M. CohenH. CuypersR. Verrijzer,2010,http://link.springer.com/article/10.1007/s11786-010-0026-5,Article
Journal Scan: Journal of Shoulder and Elbow Surgery,Clinical Orthopaedics and Related Research®,,468.0,5,10.1007/s11999-010-1273-0,Edwin E. Spencer Jr MDJay D. Keener MDAnand M. Murthi MD,2010,http://link.springer.com/article/10.1007/s11999-010-1273-0,Article
Improving the quality of use case models using antipatterns,Software & Systems Modeling,,9.0,2,10.1007/s10270-009-0112-9,Mohamed El-AttarJames Miller,2010,http://link.springer.com/article/10.1007/s10270-009-0112-9,Article
Fault-prone module detection using large-scale text features based on spam filtering,Empirical Software Engineering,,15.0,2,10.1007/s10664-009-9117-9,Hideaki HataOsamu MizunoTohru Kikuno,2010,http://link.springer.com/article/10.1007/s10664-009-9117-9,Article
The TLS Handshake Protocol: A Modular Analysis,Journal of Cryptology,,23.0,2,10.1007/s00145-009-9052-3,P. MorrisseyN. P. SmartB. Warinschi,2010,http://link.springer.com/article/10.1007/s00145-009-9052-3,Article
Evidence of a filtered approach to environmental monitoring,European Journal of Law and Economics,,29.0,2,10.1007/s10657-009-9117-7,Sandra Rousseau,2010,http://link.springer.com/article/10.1007/s10657-009-9117-7,Article
Why university members use and resist technology? A structure enactment perspective,Journal of Computing in Higher Education,,22.0,1,10.1007/s12528-010-9028-1,Canchu LinRoss SingerLouisa Ha,2010,http://link.springer.com/article/10.1007/s12528-010-9028-1,Article
AAA Stent–Grafts: Past Problems and Future Prospects,Annals of Biomedical Engineering,,38.0,4,10.1007/s10439-010-9953-1,Mital DesaiJames Eaton-EvansClaire HilleryRaheleh BakhshiZhong YouJian LuGeorge HamiltonAlexander M. Seifalian,2010,http://link.springer.com/article/10.1007/s10439-010-9953-1,Article
"Eliciting security requirements and tracing them to design: an integration of Common Criteria, heuristics, and UMLsec",Requirements Engineering,,15.0,1,10.1007/s00766-009-0093-9,Siv Hilde HoumbShareeful IslamEric KnaussJan JürjensKurt Schneider,2010,http://link.springer.com/article/10.1007/s00766-009-0093-9,Article
Statistical Tests of Conditional Independence Between Responses and/or Response Times on Test Items,Psychometrika,,75.0,1,10.1007/s11336-009-9129-9,Wim J. van der LindenCees A. W. Glas,2010,http://link.springer.com/article/10.1007/s11336-009-9129-9,Article
"Clearer Cues, More Consistent Voters: A Benefit of Elite Polarization",Political Behavior,,32.0,1,10.1007/s11109-009-9094-0,Matthew S. Levendusky,2010,http://link.springer.com/article/10.1007/s11109-009-9094-0,Article
Commonsense concepts of phenomenal consciousness: Does anyone care about functional zombies?,Phenomenology and the Cognitive Sciences,,9.0,1,10.1007/s11097-009-9126-6,Bryce Huebner,2010,http://link.springer.com/article/10.1007/s11097-009-9126-6,Article
Basel II as a casualty of the global financial crisis,Journal of Banking Regulation,,11.0,2,10.1057/jbr.2010.2,Imad A Moosa,2010,http://link.springer.com/article/10.1057/jbr.2010.2,Article
Regional business development policy in Central and Eastern Europe: a mechanism design perspective,Review of Economic Design,,14.0,1 - 2,10.1007/s10058-009-0086-7,Roswitha M. King,2010,http://link.springer.com/article/10.1007/s10058-009-0086-7,Article
Challenges facing European Monetary Union,Intereconomics,,45.0,2,10.1007/s10272-010-0326-7,,2010,http://link.springer.com/article/10.1007/s10272-010-0326-7,Article
An empirical study on the maintenance of source code clones,Empirical Software Engineering,,15.0,1,10.1007/s10664-009-9108-x,Suresh ThummalapentaLuigi CeruloLerina AversanoMassimiliano Di Penta,2010,http://link.springer.com/article/10.1007/s10664-009-9108-x,Article
"Service, value networks and learning",Journal of the Academy of Marketing Science,,38.0,1,10.1007/s11747-008-0131-z,Robert F. LuschStephen L. VargoMohan Tanniru,2010,http://link.springer.com/article/10.1007/s11747-008-0131-z,Article
Therapeutic Options to Further Lower C-Reactive Protein for Patients on Statin Treatment,Current Atherosclerosis Reports,,12.0,1,10.1007/s11883-009-0075-x,Parag H. JoshiTerry A. Jacobson,2010,http://link.springer.com/article/10.1007/s11883-009-0075-x,Article
Extracorporeal membrane oxygenation in adults with severe respiratory failure: a multi-center database,Intensive Care Medicine,,35.0,12,10.1007/s00134-009-1661-7,Thomas V. BroganRavi R. ThiagarajanPeter T. RycusRobert H. BartlettSusan L. Bratton,2009,http://link.springer.com/article/10.1007/s00134-009-1661-7,Article
How people experience and change institutions: a field guide to creative syncretism,Theory and Society,,38.0,6,10.1007/s11186-009-9095-3,Gerald BerkDennis Galvan,2009,http://link.springer.com/article/10.1007/s11186-009-9095-3,Article
Biological approaches to aphasia treatment,Current Neurology and Neuroscience Reports,,9.0,6,10.1007/s11910-009-0066-x,Steven L. SmallDaniel A. Llano,2009,http://link.springer.com/article/10.1007/s11910-009-0066-x,Article
Katrina and the Governors,Public Organization Review,,9.0,4,10.1007/s11115-009-0092-9,William L Waugh Jr.,2009,http://link.springer.com/article/10.1007/s11115-009-0092-9,Article
