Item Title,Publication Title,Book Series Title,Journal Volume,Journal Issue,Item DOI,Authors,Publication Year,URL,Content Type
Cryptanalysis and Enhancement of Anonymity Preserving Remote User Mutual Authentication and Session Key Agreement Scheme for E-Health Care Systems,Journal of Medical Systems,,39.0,11,10.1007/s10916-015-0318-z,Ruhul AminSK Hafizul IslamG. P. BiswasMuhammad Khurram KhanXiong Li,2015,http://link.springer.com/article/10.1007/s10916-015-0318-z,Article
Does test-driven development improve class design? A qualitative study on developers’ perceptions,Journal of the Brazilian Computer Society,,21.0,1,10.1186/s13173-015-0034-z,Maurício AnicheMarco Aurélio Gerosa,2015,http://link.springer.com/article/10.1186/s13173-015-0034-z,Article
Microarray experiments and factors which affect their reliability,Biology Direct,,10.0,1,10.1186/s13062-015-0077-2,Roman JaksikMarta IwanaszkoJoanna Rzeszowska-WolnyMarek Kimmel,2015,http://link.springer.com/article/10.1186/s13062-015-0077-2,Article
CoreDevRec: Automatic Core Member Recommendation for Contribution Evaluation,Journal of Computer Science and Technology,,30.0,5,10.1007/s11390-015-1577-3,Jing JiangJia-Huan HeXue-Yuan Chen,2015,http://link.springer.com/article/10.1007/s11390-015-1577-3,Article
Roundtable: Research Opportunities and Challenges for Emerging Software Systems,Journal of Computer Science and Technology,,30.0,5,10.1007/s11390-015-1572-8,Xiangyu ZhangDongmei ZhangYves Le TraonQing WangLu Zhang,2015,http://link.springer.com/article/10.1007/s11390-015-1572-8,Article
"EUROSPINE 2015 Copenhagen, Denmark, September 2–4",European Spine Journal,,24.0,6,10.1007/s00586-015-4129-1,,2015,http://link.springer.com/article/10.1007/s00586-015-4129-1,Article
Non-invasive Prenatal Screening for Fetal Aneuploidy: Comparison with Cytogenetic Results,Current Genetic Medicine Reports,,3.0,3,10.1007/s40142-015-0072-z,Jeanne M. MeckGirish V. PutchaAthena M. Cherry,2015,http://link.springer.com/article/10.1007/s40142-015-0072-z,Article
“From me to HIV”: a case study of the community experience of donor transition of health programs,BMC Infectious Diseases,,15.0,1,10.1186/s12879-015-1068-8,Daniela C. RodríguezVandana TripathiMeghan BohrenAmy PaulKriti SinghVibha ChhabraSuneeta SinghSara Bennett,2015,http://link.springer.com/article/10.1186/s12879-015-1068-8,Article
A Secure and Robust User Authenticated Key Agreement Scheme for Hierarchical Multi-medical Server Environment in TMIS,Journal of Medical Systems,,39.0,9,10.1007/s10916-015-0276-5,Ashok Kumar DasVanga OdeluAdrijit Goswami,2015,http://link.springer.com/article/10.1007/s10916-015-0276-5,Article
Are test smells really harmful? An empirical study,Empirical Software Engineering,,20.0,4,10.1007/s10664-014-9313-0,Gabriele BavotaAbdallah QusefRocco OlivetoAndrea De LuciaDave Binkley,2015,http://link.springer.com/article/10.1007/s10664-014-9313-0,Article
A combined approach for concern identification in KDM models,Journal of the Brazilian Computer Society,,21.0,1,10.1186/s13173-015-0030-3,Daniel San Martín SantibáñezRafael Serapilha DurelliValter Vieira de Camargo,2015,http://link.springer.com/article/10.1186/s13173-015-0030-3,Article
The impact of imperfect change rules on framework API evolution identification: an empirical study,Empirical Software Engineering,,20.0,4,10.1007/s10664-014-9317-9,Wei WuAdrien ServeauxYann-Gaël GuéhéneucGiuliano Antoniol,2015,http://link.springer.com/article/10.1007/s10664-014-9317-9,Article
"Evaluating visual attention for multi-screen television: measures, toolkit, and experimental findings",Personal and Ubiquitous Computing,,19.0,5 - 6,10.1007/s00779-015-0862-z,Radu-Daniel VatavuMatei Mancas,2015,http://link.springer.com/article/10.1007/s00779-015-0862-z,Article
Mixed-methods research: a new approach to evaluating the motivation and satisfaction of university students using advanced visual technologies,Universal Access in the Information Society,,14.0,3,10.1007/s10209-014-0361-4,David FonsecaErnest RedondoSergi Villagrasa,2015,http://link.springer.com/article/10.1007/s10209-014-0361-4,Article
Association of Hematocrit and Red Blood Cell Transfusion with Outcomes in Infants Undergoing Norwood Operation,Pediatric Cardiology,,36.0,6,10.1007/s00246-015-1147-z,Punkaj GuptaCaitlin KingLisle BenjaminTimothy GoodhartMichael J. RobertsonJeffrey M. GossettGina A. PesekRahul DasGupta,2015,http://link.springer.com/article/10.1007/s00246-015-1147-z,Article
On the relationship of code-anomaly agglomerations and architectural problems,Journal of Software Engineering Research and Development,,3.0,1,10.1186/s40411-015-0025-y,Willian N. OizumiAlessandro F. GarciaThelma E. ColanziManuele FerreiraArndt V. Staa,2015,http://link.springer.com/article/10.1186/s40411-015-0025-y,Article
Electronic Health Data for Postmarket Surveillance: A Vision Not Realized,Drug Safety,,38.0,7,10.1007/s40264-015-0305-9,Thomas J. MooreCurt D. Furberg,2015,http://link.springer.com/article/10.1007/s40264-015-0305-9,Article
Comprehensive gene panels provide advantages over clinical exome sequencing for Mendelian diseases,Genome Biology,,16.0,1,10.1186/s13059-015-0693-2,,2015,http://link.springer.com/article/10.1186/s13059-015-0693-2,Article
Prioritizing code-smells correction tasks using chemical reaction optimization,Software Quality Journal,,23.0,2,10.1007/s11219-014-9233-7,Ali OuniMarouane KessentiniSlim BechikhHouari Sahraoui,2015,http://link.springer.com/article/10.1007/s11219-014-9233-7,Article
Empirical evidence on the link between object-oriented measures and external quality attributes: a systematic literature review,Empirical Software Engineering,,20.0,3,10.1007/s10664-013-9291-7,Ronald JabangweJürgen BörstlerDarja ŠmiteClaes Wohlin,2015,http://link.springer.com/article/10.1007/s10664-013-9291-7,Article
Process parameter optimization of plastic injection molding: a review,International Journal of Plastics Technology,,19.0,1,10.1007/s12588-015-9115-2,Satadru KashyapDilip Datta,2015,http://link.springer.com/article/10.1007/s12588-015-9115-2,Article
"Measuring the Interest of German Students in Agriculture: the Role of Knowledge, Nature Experience, Disgust, and Gender",Research in Science Education,,45.0,3,10.1007/s11165-014-9425-y,Malte BickelMicha StrackSusanne Bögeholz,2015,http://link.springer.com/article/10.1007/s11165-014-9425-y,Article
Social debt in software engineering: insights from industry,Journal of Internet Services and Applications,,6.0,1,10.1186/s13174-015-0024-6,Damian A TamburriPhilippe KruchtenPatricia LagoHans van Vliet,2015,http://link.springer.com/article/10.1186/s13174-015-0024-6,Article
Corpus-based analysis of domain-specific languages,Software & Systems Modeling,,14.0,2,10.1007/s10270-013-0352-6,Robert TairasJordi Cabot,2015,http://link.springer.com/article/10.1007/s10270-013-0352-6,Article
F3T: a tool to support the F3 approach on the development and reuse of frameworks,Journal of Software Engineering Research and Development,,3.0,1,10.1186/s40411-015-0017-y,Matheus C VianaRosângela AD PenteadoAntônio F do PradoRafael S Durelli,2015,http://link.springer.com/article/10.1186/s40411-015-0017-y,Article
Detecting and refactoring code smells in spreadsheet formulas,Empirical Software Engineering,,20.0,2,10.1007/s10664-013-9296-2,Felienne HermansMartin PinzgerArie van Deursen,2015,http://link.springer.com/article/10.1007/s10664-013-9296-2,Article
Guest editorial: special section on software maintenance and evolution,Empirical Software Engineering,,20.0,2,10.1007/s10664-015-9382-8,Massimiliano Di PentaJonathan I. Maletic,2015,http://link.springer.com/article/10.1007/s10664-015-9382-8,Article
Making Philosophy of Science Education Practical for Science Teachers,Science & Education,,24.0,3,10.1007/s11191-014-9735-5,F. J. J. M. JanssenB. van Berkel,2015,http://link.springer.com/article/10.1007/s11191-014-9735-5,Article
Glucagon for hypoglycemic episodes in insulin-treated diabetic patients: a systematic review and meta-analysis with a comparison of glucagon with dextrose and of different glucagon formulations,Acta Diabetologica,,52.0,2,10.1007/s00592-014-0665-0,Augusto BoidoValerio CerianiAntonio E. Pontiroli,2015,http://link.springer.com/article/10.1007/s00592-014-0665-0,Article
What Are the Functional Results and Complications From Allograft Reconstruction After Partial Hemipelvectomy of the Pubis?,Clinical Orthopaedics and Related Research®,,473.0,4,10.1007/s11999-014-4009-8,"S. Mohammed Karim MDMatthew W. Colman MDSantiago A. Lozano-Calderón MD, PhDKevin A. Raskin MDJoseph H. Schwab MDFrancis J. Hornicek MD, PhD",2015,http://link.springer.com/article/10.1007/s11999-014-4009-8,Article
Road tunnel fire safety and risk: a review,Fire Science Reviews,,4.0,1,10.1186/s40038-015-0006-6,Jonatan Gehandler,2015,http://link.springer.com/article/10.1186/s40038-015-0006-6,Article
Detecting software design defects using relational association rule mining,Knowledge and Information Systems,,42.0,3,10.1007/s10115-013-0721-z,Gabriela CzibulaZsuzsanna MarianIstvan Gergely Czibula,2015,http://link.springer.com/article/10.1007/s10115-013-0721-z,Article
A method for predicting open source software residual defects,Software Quality Journal,,23.0,1,10.1007/s11219-014-9229-3,Najeeb Ullah,2015,http://link.springer.com/article/10.1007/s11219-014-9229-3,Article
Investigating the effect of evolution and refactorings on feature scattering,Software Quality Journal,,23.0,1,10.1007/s11219-013-9204-4,Theodore ChaikalisAlexander ChatzigeorgiouGeorgina Examiliotou,2015,http://link.springer.com/article/10.1007/s11219-013-9204-4,Article
On the empirical evaluation of similarity coefficients for spreadsheets fault localization,Automated Software Engineering,,22.0,1,10.1007/s10515-014-0145-3,Birgit HoferAlexandre PerezRui AbreuFranz Wotawa,2015,http://link.springer.com/article/10.1007/s10515-014-0145-3,Article
Analysis of dynamic pricing scenarios for multiple-generation product lines,Journal of Systems Science and Systems Engineering,,24.0,1,10.1007/s11518-015-5264-2,Nil Kilicay-ErginChun-yu LinGul E. Okudan,2015,http://link.springer.com/article/10.1007/s11518-015-5264-2,Article
Experience-based VAS values for EQ-5D-3L health states in a national general population health survey in China,Quality of Life Research,,24.0,3,10.1007/s11136-014-0793-6,Sun SunJiaying ChenPaul KindLing XuYaoguang ZhangKristina Burström,2015,http://link.springer.com/article/10.1007/s11136-014-0793-6,Article
Recent Developments in the Quantification and Regulation of Air Emissions from Animal Feeding Operations,Current Environmental Health Reports,,2.0,1,10.1007/s40572-014-0038-4,Tarah Heinzen,2015,http://link.springer.com/article/10.1007/s40572-014-0038-4,Article
Modeling as a trans-disciplinary formative skill and practice,TechTrends,,59.0,2,10.1007/s11528-015-0830-5,Danah HenriksenColin A. TerryPunya Mishra,2015,http://link.springer.com/article/10.1007/s11528-015-0830-5,Article
A Secure User Anonymity-Preserving Three-Factor Remote User Authentication Scheme for the Telecare Medicine Information Systems,Journal of Medical Systems,,39.0,3,10.1007/s10916-015-0218-2,Ashok Kumar Das,2015,http://link.springer.com/article/10.1007/s10916-015-0218-2,Article
UML model refactoring: a systematic literature review,Empirical Software Engineering,,20.0,1,10.1007/s10664-013-9283-7,Mohammed MisbhauddinMohammad Alshayeb,2015,http://link.springer.com/article/10.1007/s10664-013-9283-7,Article
Resolving model inconsistencies using automated regression planning,Software & Systems Modeling,,14.0,1,10.1007/s10270-013-0317-9,Jorge Pinna PuissantRagnhild Van Der StraetenTom Mens,2015,http://link.springer.com/article/10.1007/s10270-013-0317-9,Article
"A quality driven extension to the QVT-relations transformation
			language",Computer Science - Research and Development,,30.0,1,10.1007/s00450-011-0202-0,Mauro Luigi DragoCarlo GhezziRaffaela Mirandola,2015,http://link.springer.com/article/10.1007/s00450-011-0202-0,Article
An overview of vulnerability assessment and penetration testing techniques,Journal of Computer Virology and Hacking Techniques,,11.0,1,10.1007/s11416-014-0231-x,Sugandh ShahB. M. Mehtre,2015,http://link.springer.com/article/10.1007/s11416-014-0231-x,Article
Guest editorial to the special issue on “modelling–foundations and applications”,Software & Systems Modeling,,14.0,1,10.1007/s10270-013-0377-x,Antonio VallecilloJuha-Pekka Tolvanen,2015,http://link.springer.com/article/10.1007/s10270-013-0377-x,Article
An anonymous and efficient remote biometrics user authentication scheme in a multi server environment,Frontiers of Computer Science,,9.0,1,10.1007/s11704-014-3125-7,Peng JiangQiaoyan WenWenmin LiZhengping JinHua Zhang,2015,http://link.springer.com/article/10.1007/s11704-014-3125-7,Article
Work-related symptoms in indoor environments: a puzzling problem for the occupational physician,International Archives of Occupational and Environmental Health,,88.0,2,10.1007/s00420-014-0952-7,Nicola Magnavita,2015,http://link.springer.com/article/10.1007/s00420-014-0952-7,Article
Antioxidant activity of fermented Hazelnut milk,Food Science and Biotechnology,,24.0,1,10.1007/s10068-015-0016-0,Neda MalekiFaramarz KhodaiyanSeyed Mohammad Mousavi,2015,http://link.springer.com/article/10.1007/s10068-015-0016-0,Article
"Incidence, Predictors, and Outcomes of Extubation Failure in Children After Orthotopic Heart Transplantation: A Single-Center Experience",Pediatric Cardiology,,36.0,2,10.1007/s00246-014-1003-6,Punkaj GuptaVinca ChowJeffrey M. GossettJustin C. YehStephen J. Roth,2015,http://link.springer.com/article/10.1007/s00246-014-1003-6,Article
Higher education governance and performance based funding as an ecology of games,Higher Education,,69.0,2,10.1007/s10734-014-9775-4,Muhammad Azfar Nisar,2015,http://link.springer.com/article/10.1007/s10734-014-9775-4,Article
A model for reusing service knowledge based on an empirical case,Research in Engineering Design,,26.0,1,10.1007/s00163-014-0184-6,S. Ahmed-KristensenG. Vianello,2015,http://link.springer.com/article/10.1007/s00163-014-0184-6,Article
SNP arrays: comparing diagnostic yields for four platforms in children with developmental delay,BMC Medical Genomics,,7.0,1,10.1186/s12920-014-0070-0,Guylaine D’AmoursMathieu LangloisGéraldine MathonnetRaouf FetniSonia NizardMyriam SrourFrédérique TihyMichael S PhillipsJacques L MichaudEmmanuelle Lemyre,2014,http://link.springer.com/article/10.1186/s12920-014-0070-0,Article
Automating extract class refactoring: an improved method and its evaluation,Empirical Software Engineering,,19.0,6,10.1007/s10664-013-9256-x,Gabriele BavotaAndrea De LuciaAndrian MarcusRocco Oliveto,2014,http://link.springer.com/article/10.1007/s10664-013-9256-x,Article
Performance assessment of an architecture with adaptative interfaces for people with special needs,Empirical Software Engineering,,19.0,6,10.1007/s10664-013-9297-1,Elena Gómez-MartínezRafael Gonzalez-CaberoJose Merseguer,2014,http://link.springer.com/article/10.1007/s10664-013-9297-1,Article
Business processes refactoring to improve usability in E-commerce applications,Electronic Commerce Research,,14.0,4,10.1007/s10660-014-9149-0,Damiano DistanteAlejandra GarridoJulia Camelier-CarvajalRoxana GiandiniGustavo Rossi,2014,http://link.springer.com/article/10.1007/s10660-014-9149-0,Article
A review of attacks and security approaches in open multi-agent systems,Artificial Intelligence Review,,42.0,4,10.1007/s10462-012-9343-1,Shahriar BijaniDavid Robertson,2014,http://link.springer.com/article/10.1007/s10462-012-9343-1,Article
Waste identification and elimination in information technology organizations,Empirical Software Engineering,,19.0,6,10.1007/s10664-014-9302-3,Osama Al-BaikJames Miller,2014,http://link.springer.com/article/10.1007/s10664-014-9302-3,Article
Taenia solium Taeniasis and Cysticercosis Control and Elimination Through Community-Based Interventions,Current Tropical Medicine Reports,,1.0,4,10.1007/s40475-014-0029-4,Hélène CarabinAminata A. Traoré,2014,http://link.springer.com/article/10.1007/s40475-014-0029-4,Article
"Sensitivity and Specificity of Self-Reported Olfactory Function in a Home-Based Study of Independent-Living, Healthy Older Women",Chemosensory Perception,,7.0,3 - 4,10.1007/s12078-014-9170-7,Shristi RawalHoward J. HoffmanAudrey K. ChapoValerie B. Duffy,2014,http://link.springer.com/article/10.1007/s12078-014-9170-7,Article
Object oriented software metrics threshold values at quantitative acceptable risk level,CSI Transactions on ICT,,2.0,3,10.1007/s40012-014-0057-1,Satwinder SinghK. S. Kahlon,2014,http://link.springer.com/article/10.1007/s40012-014-0057-1,Article
Object-Oriented Class Stability Prediction: A Comparison Between Artificial Neural Network and Support Vector Machine,Arabian Journal for Science and Engineering,,39.0,11,10.1007/s13369-014-1372-4,Mohammad AlshayebYagoub EisaMoataz A. Ahmed,2014,http://link.springer.com/article/10.1007/s13369-014-1372-4,Article
Data standards quality measured for achieving enterprise interoperability: the case of the SETU standard for flexible staffing,Information Systems and e-Business Management,,12.0,4,10.1007/s10257-014-0236-5,Erwin FolmerHarris WuMichael van Bekkum,2014,http://link.springer.com/article/10.1007/s10257-014-0236-5,Article
Improving accessibility of Web interfaces: refactoring to the rescue,Universal Access in the Information Society,,13.0,4,10.1007/s10209-013-0323-2,Alejandra GarridoGustavo RossiNuria Medina MedinaJulián GrigeraSergio Firmenich,2014,http://link.springer.com/article/10.1007/s10209-013-0323-2,Article
The Tinnitus Retraining Therapy Trial (TRTT): study protocol for a randomized controlled trial,Trials,,15.0,1,10.1186/1745-6215-15-396,Roberta W SchererCraig FormbySusan GoldSue ErdmanCharles RodheMichele CarlsonDave ShadeMelanie TuckerLee McCaffrey SensingerGordon HughesGeorge S ConleyNaomi DowneyCynthia EadesMargaret JylkkaAda Haber-PerezCourtney Harper,2014,http://link.springer.com/article/10.1186/1745-6215-15-396,Article
Reengineering component-based software systems with Archimetrix,Software & Systems Modeling,,13.0,4,10.1007/s10270-013-0341-9,Markus von DettenMarie Christin PlateniusSteffen Becker,2014,http://link.springer.com/article/10.1007/s10270-013-0341-9,Article
Stateful component-based performance models,Software & Systems Modeling,,13.0,4,10.1007/s10270-013-0336-6,Lucia HappeBarbora BuhnovaRalf Reussner,2014,http://link.springer.com/article/10.1007/s10270-013-0336-6,Article
Information extraction from topographic map using colour and shape analysis,Sadhana,,39.0,5,10.1007/s12046-014-0270-5,NIKAM GITANJALI GANPATRAOJAYANTA KUMAR GHOSH,2014,http://link.springer.com/article/10.1007/s12046-014-0270-5,Article
Deriving performance-relevant infrastructure properties through model-based experiments with Ginpex,Software & Systems Modeling,,13.0,4,10.1007/s10270-013-0335-7,Michael HauckMichael KuperbergNikolaus HuberRalf Reussner,2014,http://link.springer.com/article/10.1007/s10270-013-0335-7,Article
Software Engineering with Transactional Memory Versus Locks in Practice,Theory of Computing Systems,,55.0,3,10.1007/s00224-013-9452-5,Victor PankratiusAli-Reza Adl-Tabatabai,2014,http://link.springer.com/article/10.1007/s00224-013-9452-5,Article
Online case-based discussions: examining coverage of the afforded problem space,Educational Technology Research and Development,,62.0,5,10.1007/s11423-014-9350-9,Peggy A. ErtmerAdrie A. Koehler,2014,http://link.springer.com/article/10.1007/s11423-014-9350-9,Article
Comparing enfant and PowerDiva sweep visual evoked potential (sVEP) acuity estimates,Documenta Ophthalmologica,,129.0,2,10.1007/s10633-014-9457-7,William H. Ridder IIIBradley S. WaiteTimothy F. Melton,2014,http://link.springer.com/article/10.1007/s10633-014-9457-7,Article
Analytical lenses on barriers in the governance of climate change adaptation,Mitigation and Adaptation Strategies for Global Change,,19.0,7,10.1007/s11027-013-9457-z,G. Robbert BiesbroekCatrien J. A. M. TermeerJudith E. M. KlostermannPavel Kabat,2014,http://link.springer.com/article/10.1007/s11027-013-9457-z,Article
Invasive species contribute to biotic resistance: negative effect of caprellid amphipods on an invasive tunicate,Biological Invasions,,16.0,10,10.1007/s10530-014-0659-4,Samuel B. CollinLadd E. Johnson,2014,http://link.springer.com/article/10.1007/s10530-014-0659-4,Article
Gastric Bypass for Obesity in the Elderly: Is It as Appropriate as for Young and Middle-Aged Populations?,Obesity Surgery,,24.0,10,10.1007/s11695-014-1247-5,Maud RobertArnaud PasquerPhilippe EspalieuMartine LavilleChristian GouillatEmmanuel Disse,2014,http://link.springer.com/article/10.1007/s11695-014-1247-5,Article
"The problem of conceptualization in god class detection: agreement, strategies and decision drivers",Journal of Software Engineering Research and Development,,2.0,1,10.1186/s40411-014-0011-9,José Amancio M SantosManoel Gomes de MendonçaCleber Pereira dos SantosRenato Lima Novais,2014,http://link.springer.com/article/10.1186/s40411-014-0011-9,Article
Feasibility of repellent use in a context of increasing outdoor transmission: a qualitative study in rural Tanzania,Malaria Journal,,13.0,1,10.1186/1475-2875-13-347,Onyango SangoroAnn H KellySarah MtaliSarah J Moore,2014,http://link.springer.com/article/10.1186/1475-2875-13-347,Article
Comparing four approaches for technical debt identification,Software Quality Journal,,22.0,3,10.1007/s11219-013-9200-8,Nico ZazworkaAntonio Vetro’Clemente IzurietaSunny WongYuanfang CaiCarolyn SeamanForrest Shull,2014,http://link.springer.com/article/10.1007/s11219-013-9200-8,Article
Supporting requirements to code traceability through refactoring,Requirements Engineering,,19.0,3,10.1007/s00766-013-0197-0,Anas MahmoudNan Niu,2014,http://link.springer.com/article/10.1007/s00766-013-0197-0,Article
"Preventing, Detecting, and Revising Flaws in Object Property Expressions",Journal on Data Semantics,,3.0,3,10.1007/s13740-013-0028-y,C. Maria Keet,2014,http://link.springer.com/article/10.1007/s13740-013-0028-y,Article
Combining human error verification and timing analysis: a case study on an infusion pump,Formal Aspects of Computing,,26.0,5,10.1007/s00165-013-0288-1,Rimvydas RukšėnasPaul CurzonAnn BlandfordJonathan Back,2014,http://link.springer.com/article/10.1007/s00165-013-0288-1,Article
Assessing the capability of code smells to explain maintenance problems: an empirical study combining quantitative and qualitative data,Empirical Software Engineering,,19.0,4,10.1007/s10664-013-9250-3,Aiko Yamashita,2014,http://link.springer.com/article/10.1007/s10664-013-9250-3,Article
Predicting object-oriented class reuse-proneness using internal quality attributes,Empirical Software Engineering,,19.0,4,10.1007/s10664-012-9239-3,Jehad Al DallalSandro Morasca,2014,http://link.springer.com/article/10.1007/s10664-012-9239-3,Article
Municipal web sites accessibility and usability for blind users: preliminary results from a pilot study,Universal Access in the Information Society,,13.0,3,10.1007/s10209-013-0315-2,Costin PribeanuPaul Fogarassy-NeszlyAurel Pătru,2014,http://link.springer.com/article/10.1007/s10209-013-0315-2,Article
Design-time formal verification for smart environments: an exploratory perspective,Journal of Ambient Intelligence and Humanized Computing,,5.0,4,10.1007/s12652-013-0209-4,Fulvio CornoMuhammad Sanaullah,2014,http://link.springer.com/article/10.1007/s12652-013-0209-4,Article
The Impact of Depression on Driver Performance,International Journal of Mental Health and Addiction,,12.0,4,10.1007/s11469-014-9487-0,Christine M. WickensReginald G. SmartRobert E. Mann,2014,http://link.springer.com/article/10.1007/s11469-014-9487-0,Article
Simulation of long-term fatigue damage in bioprosthetic heart valves: effects of leaflet and stent elastic properties,Biomechanics and Modeling in Mechanobiology,,13.0,4,10.1007/s10237-013-0532-x,Caitlin MartinWei Sun,2014,http://link.springer.com/article/10.1007/s10237-013-0532-x,Article
Identification of probe request attacks in WLANs using neural networks,Neural Computing and Applications,,25.0,1,10.1007/s00521-013-1478-8,Deepthi N. RatnayakeHassan B. KazemianSyed A. Yusuf,2014,http://link.springer.com/article/10.1007/s00521-013-1478-8,Article
A case study on consistency management of business and IT process models in banking,Software & Systems Modeling,,13.0,3,10.1007/s10270-013-0318-8,Moisés Castelo BrancoYingfei XiongKrzysztof CzarneckiJochen KüsterHagen Völzer,2014,http://link.springer.com/article/10.1007/s10270-013-0318-8,Article
Identifying extract class refactoring opportunities for internetware,Science China Information Sciences,,57.0,7,10.1007/s11432-013-5024-1,Lin ChenJu QianYuMing ZhouPeng WangBaoWen Xu,2014,http://link.springer.com/article/10.1007/s11432-013-5024-1,Article
Evidence-driven decision support in critical infrastructure management through enhanced domain knowledge modeling,Multimedia Tools and Applications,,71.0,1,10.1007/s11042-013-1469-x,Seok-Won Lee,2014,http://link.springer.com/article/10.1007/s11042-013-1469-x,Article
"Synthesis, Crystal Structure, Vibrational Spectra, Optical Properties and Thermal Analysis of a New Chlorocadmate Templated by 1-(2-Ammoniumethyl) Piperazinium",Journal of Inorganic and Organometallic Polymers and Materials,,24.0,4,10.1007/s10904-014-0034-z,Melek HajjiAmel GharbiTaha Guerfel,2014,http://link.springer.com/article/10.1007/s10904-014-0034-z,Article
An Enhanced Biometric Authentication Scheme for Telecare Medicine Information Systems with Nonce Using Chaotic Hash Function,Journal of Medical Systems,,38.0,6,10.1007/s10916-014-0027-z,Ashok Kumar DasAdrijit Goswami,2014,http://link.springer.com/article/10.1007/s10916-014-0027-z,Article
